mondo_id	property	value_old	value_new
MONDO:0017309	definition	Neonatal Marfan syndrome is a rare, severe and life-threatening genetic disease, occuring during the neonatal period, characterized by classical Marfan syndrome manifestations in addition to facial dysmorphism (megalocornea, iridodonesis, ectopia lentis, crumpled ears, loose redundant skin giving a 'senile' facial appearance), flexion joint contractures, pulmonary emphysema, and a severe, rapidly progressive cardiovascular disease (including ascending aortic dilatation and severe mitral and/or tricuspid valve insufficiency). Additionally, skeletal manifestations (arachnodactyly, dolichostenomelia, pectus deformities) are also associated.	Neonatal Marfan syndrome is a rare, severe and life-threatening genetic disease, occurring during the neonatal period, characterized by classical Marfan syndrome manifestations in addition to facial dysmorphism (megalocornea, iridodonesis, ectopia lentis, crumpled ears, loose redundant skin giving a 'senile' facial appearance), flexion joint contractures, pulmonary emphysema, and a severe, rapidly progressive cardiovascular disease (including ascending aortic dilatation and severe mitral and/or tricuspid valve insufficiency). Additionally, skeletal manifestations (arachnodactyly, dolichostenomelia, pectus deformities) are also associated.
MONDO:0018125	definition	Focal epilepsy-intellectual disability-cerebro-cerebellar malformation is a rare, genetic neurological disorder characterized by early infantile-onset of seizures, borderline to moderate intellectual disability, cerebellar features including dysarthria and ataxia and cerebellar atrophy and cortical thickening observed on MRI imaging. Seizures are typically focal (with prominent eye blinking, facial and limb jerking), precipitated by fever and often commence with an oral sensory aura (anesthetized tongue sensation). When not properly controlled by anti-epileptic medication, weekly frequency and persistance into adult life is observed.	Focal epilepsy-intellectual disability-cerebro-cerebellar malformation is a rare, genetic neurological disorder characterized by early infantile-onset of seizures, borderline to moderate intellectual disability, cerebellar features including dysarthria and ataxia and cerebellar atrophy and cortical thickening observed on MRI imaging. Seizures are typically focal (with prominent eye blinking, facial and limb jerking), precipitated by fever and often commence with an oral sensory aura (anesthetized tongue sensation). When not properly controlled by anti-epileptic medication, weekly frequency and persistence into adult life is observed.
MONDO:0018449	definition	Acquired cystic disease-associated renal cell carcinoma is a rare subtype of renal cell carcinoma, ocurring in the context of end-stage kidney disease and acquired cystic kidney disease, characterized by a usually well circumscribed, solid, multifocal, bilateral tumor with inter- or intracellular microlumen formation (leading to cribiform architecture). Tumors are often diagnosed incidentally in early stages, although complications caused by renal cysts (dull flank or abdominal pain, fever) or renal parenchymal bleeding may mask the underlying neoplastic process. Most have an indolent behavior.	Acquired cystic disease-associated renal cell carcinoma is a rare subtype of renal cell carcinoma, occurring in the context of end-stage kidney disease and acquired cystic kidney disease, characterized by a usually well circumscribed, solid, multifocal, bilateral tumor with inter- or intracellular microlumen formation (leading to cribiform architecture). Tumors are often diagnosed incidentally in early stages, although complications caused by renal cysts (dull flank or abdominal pain, fever) or renal parenchymal bleeding may mask the underlying neoplastic process. Most have an indolent behavior.
MONDO:0018533	definition	Undifferentiated carcinoma of liver and intrahepatic biliary tract is an extremely rare epithelial tumor of the liver and biliary tract which presents heterogenous histological findings and not yet fully defined clinicopathological characterisitcs. Patients usually present with nonspecific signs and symptoms, such as abdominal pain, nausea, vomiting, anorexia, weight loss and/or jaundice. Invasive growth, hight metastatic potential and a rapid clinical course are typically associated.	Undifferentiated carcinoma of liver and intrahepatic biliary tract is an extremely rare epithelial tumor of the liver and biliary tract which presents heterogenous histological findings and not yet fully defined clinicopathological characteristics. Patients usually present with nonspecific signs and symptoms, such as abdominal pain, nausea, vomiting, anorexia, weight loss and/or jaundice. Invasive growth, high metastatic potential and a rapid clinical course are typically associated.
MONDO:0018784	definition	Pediatric multiple sclerosis (MS) is a rare multiple sclerosis variant characterized by the onset of multiple sclerosis (i.e. one or multiple episodes of clinical CNS symptoms consistent with acquired CNS demyelination, with radiologically proven dissemination of inflammatory lesions in space and time, following exclusion of other disorders) before the age of 18 years old. Pediatric MS patients present a predominantly relapsing-remitting course with first attack usually consisting of optic neuritis, transverse myelitis, acute disseminated encephalomyelitis and monofocal or polyfocal neurological deficits. A high burden of T2-hyperintense lesions on intial MRI, primarily of the supratentorial region and/or of the cervical spinal cord, has been reported.	Pediatric multiple sclerosis (MS) is a rare multiple sclerosis variant characterized by the onset of multiple sclerosis (i.e. one or multiple episodes of clinical CNS symptoms consistent with acquired CNS demyelination, with radiologically proven dissemination of inflammatory lesions in space and time, following exclusion of other disorders) before the age of 18 years old. Pediatric MS patients present a predominantly relapsing-remitting course with first attack usually consisting of optic neuritis, transverse myelitis, acute disseminated encephalomyelitis and monofocal or polyfocal neurological deficits. A high burden of T2-hyperintense lesions on initial MRI, primarily of the supratentorial region and/or of the cervical spinal cord, has been reported.
MONDO:0018933	definition	Mazabraud syndrome is a rare primary bone dysplasia characterized by the association of fibrous dysplasia with intramuscular myxomas. Fibrous dysplasia (usually polyostotic, sometimes monostotic) occurs during the growth period and can be asymptomatic or can present with pain, skeletal deformities or fractures while intramuscular myxoma, associated with polyostotic fibrous dysplasia is usually multifocal, typically occuring in the vicinity of skeletal lesions, and presents in adulthood as a painless soft-tissue mass (most commonly in the thigh). Although it is a benign condition, local recurrences of myxomas after incomplete excision and malignant transformation of a fibrous dysplastic lesion into osteogenic sarcoma have been reported.	Mazabraud syndrome is a rare primary bone dysplasia characterized by the association of fibrous dysplasia with intramuscular myxomas. Fibrous dysplasia (usually polyostotic, sometimes monostotic) occurs during the growth period and can be asymptomatic or can present with pain, skeletal deformities or fractures while intramuscular myxoma, associated with polyostotic fibrous dysplasia is usually multifocal, typically occurring in the vicinity of skeletal lesions, and presents in adulthood as a painless soft-tissue mass (most commonly in the thigh). Although it is a benign condition, local recurrences of myxomas after incomplete excision and malignant transformation of a fibrous dysplastic lesion into osteogenic sarcoma have been reported.
MONDO:0018983	definition	Tolosa-Hunt syndrome is an ophthalmoplegic syndrome, affecting all age groups, characterized by acute attacks (lasting a few days to a few weeks) of periorbital pain, ipsilateral ocular motor nerve palsies, ptosis, disordered eye movements and blurred vision usually caused by a non-specific inflammatory process in the cavernous sinus and superior orbital fissure. It has an unpredicatable course with spontaneous remission occurring in some and recurrence of attacks in others.	Tolosa-Hunt syndrome is an ophthalmoplegic syndrome, affecting all age groups, characterized by acute attacks (lasting a few days to a few weeks) of periorbital pain, ipsilateral ocular motor nerve palsies, ptosis, disordered eye movements and blurred vision usually caused by a non-specific inflammatory process in the cavernous sinus and superior orbital fissure. It has an unpredictable course with spontaneous remission occurring in some and recurrence of attacks in others.
MONDO:0018992	definition	Riedel thyroiditis is a fibroinflammatory disorder of the thyroid gland, occuring more frequently in females, characterized a large, hard thyroid mass, and presenting with pressure symptoms (breathing difficulB,ties and dysphagia) or voice hoarseness and aphonia (impingement of recurrent laryngeal nerve). It can often be associated with extracervical fibroinflammatory disorders such as retroperitoneal fibrosis, primary scleroisng cholangitis and autoimmune diseases such as Hashimoto struma, Addison disease, and Biermer disease.	Riedel thyroiditis is a fibroinflammatory disorder of the thyroid gland, occurring more frequently in females, characterized a large, hard thyroid mass, and presenting with pressure symptoms (breathing difficulB,ties and dysphagia) or voice hoarseness and aphonia (impingement of recurrent laryngeal nerve). It can often be associated with extracervical fibroinflammatory disorders such as retroperitoneal fibrosis, primary scleroisng cholangitis and autoimmune diseases such as Hashimoto struma, Addison disease, and Biermer disease.
MONDO:0019158	definition	Tropical endomyocardial fibrosis is a restrictive cardiopathy, occuring almost exclusively in children and young adults in tropical and subtropical regions, characterized by endocardial fibrosis, affecting the apices and the inflow tract of the right or left ventricle (or both) and manifesting with a restrictive cardimyopathy and atrioventricular regurgitation leading to severe pulmonary hypertension, very high systemic venous pressure and congestive cardiac failure. Suspected etiologies include helminth and protozoal infestation and malnutrition.	Tropical endomyocardial fibrosis is a restrictive cardiopathy, occurring almost exclusively in children and young adults in tropical and subtropical regions, characterized by endocardial fibrosis, affecting the apices and the inflow tract of the right or left ventricle (or both) and manifesting with a restrictive cardimyopathy and atrioventricular regurgitation leading to severe pulmonary hypertension, very high systemic venous pressure and congestive cardiac failure. Suspected etiologies include helminth and protozoal infestation and malnutrition.
MONDO:0019311	definition	Woolly hair nevus (WHN) is a rare non-familial hair anomaly characterized by kinky, tightly coiled, and hypopigmented fine hair with an average diameter of 0.5 cm, noted, since birth or during the first two years of life, in a localized circumscribed distribution on the scalp. Occassionally, WHN grows in areas observed to be alopecic in the neonatal period. WHN can be associated with features like ocular defects (persistent pupillary membrane, retinal defects), precocious puberty, and epidermal nevi.	Woolly hair nevus (WHN) is a rare non-familial hair anomaly characterized by kinky, tightly coiled, and hypopigmented fine hair with an average diameter of 0.5 cm, noted, since birth or during the first two years of life, in a localized circumscribed distribution on the scalp. Occasionally, WHN grows in areas observed to be alopecic in the neonatal period. WHN can be associated with features like ocular defects (persistent pupillary membrane, retinal defects), precocious puberty, and epidermal nevi.
MONDO:0019357	definition	Congenital cervical spinal stenosis is a rare neurological disease characterized by a congenital narrowing of the bony anatomy of the cervical spinal canal (saggital diameter <14mm), predisposing the individual to symptomatic neural compression, such as cramps, paresthesias, pain, muscle hypertonia and weakness, myelopathy and sphincter disturbances.	Congenital cervical spinal stenosis is a rare neurological disease characterized by a congenital narrowing of the bony anatomy of the cervical spinal canal (sagittal diameter <14mm), predisposing the individual to symptomatic neural compression, such as cramps, paresthesias, pain, muscle hypertonia and weakness, myelopathy and sphincter disturbances.
MONDO:0019364	definition	Pseudotyphus of California is a rare, flea-borne Rickettsial disease caused by a Rickettsia felis infection. Patients can be asymptomatic or can present with unspecific symptoms (such as fever, headache, generalized maculopapular rash, myalgia, arthralgia and, ocasionally, eschar. lymphadenopathy, nausea, vomiting, loss of appetite and abdominal pain. Rarely, serious manifestations may occur and include neurological dysfunction (photophobia, hearing loss, and signs of meningitis) and pulmonary compromise.	Pseudotyphus of California is a rare, flea-borne Rickettsial disease caused by a Rickettsia felis infection. Patients can be asymptomatic or can present with unspecific symptoms (such as fever, headache, generalized maculopapular rash, myalgia, arthralgia and, occasionally, eschar. lymphadenopathy, nausea, vomiting, loss of appetite and abdominal pain. Rarely, serious manifestations may occur and include neurological dysfunction (photophobia, hearing loss, and signs of meningitis) and pulmonary compromise.
MONDO:0019868	definition	Mosaic trisomy 10 is a rare chromosomal anomaly syndrome, with a highly variable phenotype, principally characterized by growth delay, craniofacial dysmorphism (incl. prominent forehead, hypertelorism, upslanting palpebral fissures, blepharophimosis, low-set malformed large ears, high arched palate, cleft lip/palate, retrognathia) and cardiac, renal and skeletal (e.g. radial ray defects, scoliosis) malformations, with death usually ocurring neonatally or in early infancy. Other reported features include central nervous system and ear anomalies, as well as facial clefts and anal atresia.	Mosaic trisomy 10 is a rare chromosomal anomaly syndrome, with a highly variable phenotype, principally characterized by growth delay, craniofacial dysmorphism (incl. prominent forehead, hypertelorism, upslanting palpebral fissures, blepharophimosis, low-set malformed large ears, high arched palate, cleft lip/palate, retrognathia) and cardiac, renal and skeletal (e.g. radial ray defects, scoliosis) malformations, with death usually occurring neonatally or in early infancy. Other reported features include central nervous system and ear anomalies, as well as facial clefts and anal atresia.
MONDO:0019889	definition	Distal trisomy 22q is a rare chromosomal anomaly syndrome, resulting from the partial duplication of the long arm of chromosome 22, with variable phenotype principally characterized by varying degrees of intellectual disabilty and developmental delay, pre- and postnatal growth deficiency, hypotonia, and craniofacial dysmorphism (incl. microcephaly, hypertelorism, narrow and upslanted palpebral fissures, epicanthic folds, low-set dysplastic ears, broad and depressed nasal bridge, cleft lip an/or palate, long philtrum, retro/micrognathia). Congenital heart defects, as well as cerebral, skeletal, renal and genital anomalies, have also been reported.	Distal trisomy 22q is a rare chromosomal anomaly syndrome, resulting from the partial duplication of the long arm of chromosome 22, with variable phenotype principally characterized by varying degrees of intellectual disability and developmental delay, pre- and postnatal growth deficiency, hypotonia, and craniofacial dysmorphism (incl. microcephaly, hypertelorism, narrow and upslanted palpebral fissures, epicanthic folds, low-set dysplastic ears, broad and depressed nasal bridge, cleft lip an/or palate, long philtrum, retro/micrognathia). Congenital heart defects, as well as cerebral, skeletal, renal and genital anomalies, have also been reported.
MONDO:0020440	definition	Persistent left superior vena cava connecting to the left-sided atrium is a rare, congenital vascular malformation of the major vessels characterized by a persitent left superior vena cava which drains directly to the left atrium, without passing through the coronary sinus (that may be absent in some cases). Patients are usually asymptomatic and discovered incidentally, however hypoxia, cyanosis, murmurs, palpitations, cardiac structural anomalies (e.g. atrial septal defect, bicuspid aortic valve, cor triatrium) and risk of paradoxical embolization may be associated.	Persistent left superior vena cava connecting to the left-sided atrium is a rare, congenital vascular malformation of the major vessels characterized by a persistent left superior vena cava which drains directly to the left atrium, without passing through the coronary sinus (that may be absent in some cases). Patients are usually asymptomatic and discovered incidentally, however hypoxia, cyanosis, murmurs, palpitations, cardiac structural anomalies (e.g. atrial septal defect, bicuspid aortic valve, cor triatrium) and risk of paradoxical embolization may be associated.
MONDO:0020476	definition	Mesial temporal lobe epilepsy with hippocampal sclerosis is a rare epilepsy syndrome defined by seizures originating in limbic areas of the mesial temporal lobe, particularly in the hippocampus, amygdala, and in the parahippocampal gyrus and its connections, and hippocampal sclerosis, usually unilateral or assymetric. It is frequently associated with an initial precipitating event, such as febrile seizures, hypoxia, intracranial infection or head trauma, most often occurring in the first five years of life, followed by a latent period without seizures. Typical seizures consist of a characteristic aura that is frequently a rising epigastric sensation associated with emotional disturbances, illusions, and autonomic symptoms (widened pupils, palpitations), progressive impairment of consciousness, oro-alimentary automatisms (lip smacking, chewing, licking, tooth grinding), behavioral arrest, head deviation, dystonic postures, hand and verbal automatisms. Seizures are followed by postictal dysfunction. Initially, seizures are easily controlled with antiepileptic drugs, later they frequently become refractory and associated with progressive behavioral changes and memory deficits.	Mesial temporal lobe epilepsy with hippocampal sclerosis is a rare epilepsy syndrome defined by seizures originating in limbic areas of the mesial temporal lobe, particularly in the hippocampus, amygdala, and in the parahippocampal gyrus and its connections, and hippocampal sclerosis, usually unilateral or asymmetric. It is frequently associated with an initial precipitating event, such as febrile seizures, hypoxia, intracranial infection or head trauma, most often occurring in the first five years of life, followed by a latent period without seizures. Typical seizures consist of a characteristic aura that is frequently a rising epigastric sensation associated with emotional disturbances, illusions, and autonomic symptoms (widened pupils, palpitations), progressive impairment of consciousness, oro-alimentary automatisms (lip smacking, chewing, licking, tooth grinding), behavioral arrest, head deviation, dystonic postures, hand and verbal automatisms. Seizures are followed by postictal dysfunction. Initially, seizures are easily controlled with antiepileptic drugs, later they frequently become refractory and associated with progressive behavioral changes and memory deficits.
MONDO:0020542	definition	Malignant Sertoli-Leydig cell tumor of ovary is a rare malignant sex cord stromal tumor of ovary occuring typically in young women and characterized by manifestations of androgen excess (hirsutism, hair loss, amenorrhea, or oligomenorrhea), when functional.	Malignant Sertoli-Leydig cell tumor of ovary is a rare malignant sex cord stromal tumor of ovary occurring typically in young women and characterized by manifestations of androgen excess (hirsutism, hair loss, amenorrhea, or oligomenorrhea), when functional.
MONDO:0021851	definition	A syndrome characterized by total alopecia (hair loss), total vitíligo, and nail changes. The nail changes consist of fine pitting, associated with softness, and friability and may include horizontal splitting. The vitiligo is characterized by complete, rapid uniform loss of pigment which occurrs without going through a patchy state. The entire cutaneous surface is light and translucent-appearing and is prone to burning on exposure to the sun.	A syndrome characterized by total alopecia (hair loss), total vitíligo, and nail changes. The nail changes consist of fine pitting, associated with softness, and friability and may include horizontal splitting. The vitiligo is characterized by complete, rapid uniform loss of pigment which occurs without going through a patchy state. The entire cutaneous surface is light and translucent-appearing and is prone to burning on exposure to the sun.
MONDO:0032783	definition		Any aortic valve disease characterized by aortic stenosis and/or bicuspid aortic valve in which the cause of the disease is a mutation in the ROBO4 gene.
MONDO:0035238	definition	A rare subtype of pyoderma gangrenosum disease characterized by a solitary, erythematous, ulcerated plaque, which lacks the violaceous border typically present in classic pyoderma gangrenosum, usually affecting individuals who are otherwise healthy. Histologically, the lesion presents a central layer containing neutrophilic inflamation, surrounded by a palisade of histiocytes, which are rimmed by a lymphocytic infiltrate. In comparison with the other variants of pyoderma gangrenosum, this subtype usually shows a good response to less aggressive treatments and underlying systemic disorders are less frequently associated. It is considered the most benign and uncommon clinical variant of pyoderma gangrenosum.	A rare subtype of pyoderma gangrenosum disease characterized by a solitary, erythematous, ulcerated plaque, which lacks the violaceous border typically present in classic pyoderma gangrenosum, usually affecting individuals who are otherwise healthy. Histologically, the lesion presents a central layer containing neutrophilic inflammation, surrounded by a palisade of histiocytes, which are rimmed by a lymphocytic infiltrate. In comparison with the other variants of pyoderma gangrenosum, this subtype usually shows a good response to less aggressive treatments and underlying systemic disorders are less frequently associated. It is considered the most benign and uncommon clinical variant of pyoderma gangrenosum.
MONDO:0043101	definition	Hypothalamic dysfunction refers to a condition in which the hypothalamus is not working properly. The hypothalamus produces hormones that control body temperature, hunger, moods, release of hormones from many glands such as the pituitary gland, sex drive, sleep, and thirst. The signs and symptoms patients havevary depending on the hormones missing.Anumber of different causes including anorexia, bleeding, genetic disorder, tumors, and more have been linked to hypothalamic dysfunction. Treatment depends on the cause of the hypothalamic dysfunction.	Hypothalamic dysfunction refers to a condition in which the hypothalamus is not working properly. The hypothalamus produces hormones that control body temperature, hunger, moods, release of hormones from many glands such as the pituitary gland, sex drive, sleep, and thirst. The signs and symptoms patients have vary depending on the hormones missing. A number of different causes including anorexia, bleeding, genetic disorder, tumors, and more have been linked to hypothalamic dysfunction. Treatment depends on the cause of the hypothalamic dysfunction.
MONDO:0100078	definition	A severe medical condition which is estimated to appear in 9-18% of hypertensive patients, in which treatement with 3 or more antihypertensive drugs including diuretics are ineffective.	A severe medical condition which is estimated to appear in 9-18% of hypertensive patients, in which treatment with 3 or more antihypertensive drugs including diuretics are ineffective.
MONDO:0100098	definition	A dopa-responsive dystonia characterized by marked motor delay, but no intellectual disablity, and only minimal, if any, hyperphenylalaninemia.	A dopa-responsive dystonia characterized by marked motor delay, but no intellectual disability, and only minimal, if any, hyperphenylalaninemia.
MONDO:0100160	definition	An acute disease characterized by severe ketoacidosis in the absence of diabetes mellitus and occuring in individuals with a history of prolonged excessive alcohol consumption. Disease manifestations include nausea, intractable vomiting, and abdominal pain. When treated, AKA resolves rapidly and completely with no apparent sequelae.	An acute disease characterized by severe ketoacidosis in the absence of diabetes mellitus and occurring in individuals with a history of prolonged excessive alcohol consumption. Disease manifestations include nausea, intractable vomiting, and abdominal pain. When treated, AKA resolves rapidly and completely with no apparent sequelae.
