mondo_id	label	definition	obsolete	obsoletion_candidate
MONDO:1016858	caudal maxillary sinus cyst, non-human animal			
MONDO:1016859	frontal sinus cyst, non-human animal			
MONDO:1016860	rostral maxillary sinus cyst, non-human animal			
MONDO:1016867	testicular aplasia/hypoplasia, non-human animal			
MONDO:1016868	testicular degeneration, non-human animal			
MONDO:1016869	Turner syndrome, non-human animal			
MONDO:1016871	udder impetigo, non-human animal			
MONDO:1016872	urachal rupture, non-human animal			
MONDO:1016873	urethral defect, non-human animal			
MONDO:1016874	urethral sphincter weakness, non-human animal			
MONDO:1016875	urovagina, non-human animal			
MONDO:1016876	uveal cyst, non-human animal			
MONDO:1016877	vaginal agenesis, non-human animal			
MONDO:1016878	vaginal hematoma, non-human animal			
MONDO:1016890	vocal fold collapse, non-human animal			
MONDO:1016911	knemidocoptiasis, non-human animal			
MONDO:1016912	hock burn, non-human animal			
MONDO:1016913	breast blister, non-human animal			
MONDO:1016932	endometrial cystic hyperplasia, non-human animal			
MONDO:1016933	puerperal hypocalcemia, non-human animal			
MONDO:1016934	mammary mass, non-human animal			
MONDO:1016935	metritis, non-human animal			
MONDO:1016936	misalliance, non-human animal			
MONDO:1016937	pseudopregnancy, non-human animal			
MONDO:1016938	dystocia due to fetal maldisposition, non-human animal			
MONDO:1016939	dystocia due to fetopelvic disproportion, non-human animal			
MONDO:1016940	dystocia due to uterine inertia, non-human animal			
MONDO:1016941	mammary carcinoma, non-human animal	Breast carcinoma that occurs in non-human animals.		
MONDO:1016942	mammary complex carcinoma, non-human animal			
MONDO:1016943	mammary inflammatory carcinoma, non-human animal			
MONDO:1016944	mammary simple carcinoma, non-human animal			
MONDO:1016945	mammary carcinoma in situ, non-human animal			
MONDO:1016946	mammary complex carcinoma in situ, non-human animal			
MONDO:1016947	mammary inflammatory carcinoma in situ, non-human animal			
MONDO:1016948	mammary simple carcinoma in situ, non-human animal			
MONDO:1016949	uterine mass, non-human animal			
MONDO:1016950	uterine adenocarcinoma, non-human animal			
MONDO:1016951	mammary adenoma, non-human animal			
MONDO:1016952	mammary basaloid adenoma, non-human animal			
MONDO:1016953	mammary complex adenoma, non-human animal			
MONDO:1016954	mammary simple adenoma, non-human animal			
MONDO:1016955	uterine adenoma, non-human animal			
MONDO:1016956	mammary extraskeletal osteosarcoma, non-human animal			
MONDO:1016957	mammary fibroadenoma, non-human animal			
MONDO:1016958	mammary fibrosarcoma, non-human animal			
MONDO:1016959	mammary papilloma, non-human animal			
MONDO:1016960	multiple mammary papillomas, non-human animal			
MONDO:1016961	mammary squamous cell carcinoma, non-human animal			
MONDO:1016962	complication of parturition, non-human animal			
MONDO:1016963	acute mastitis, non-human animal			
MONDO:1016964	bacterial mastitis, non-human animal			
MONDO:1016965	uterine prolapse, non-human animal			
MONDO:1016966	fetal death, non-human animal			
MONDO:1016967	uterine adhesions, non-human animal			
MONDO:1016968	agalactia, non-human animal			
MONDO:1016971	parturient hemorrhage, non-human animal			
MONDO:1016972	parturient uterine artery haemorrhage, non-human animal			
MONDO:1016973	parturient trauma, non-human animal			
MONDO:1016974	parturient cervical injury, non-human animal			
MONDO:1016975	parturient perineal laceration, non-human animal			
MONDO:1016976	parturient uterine rupture, non-human animal			
MONDO:1016977	endometrial cup retention			
MONDO:1016978	endometrial cyst, non-human animal			
MONDO:1016979	endometrial fibrosis, non-human animal			
MONDO:1016980	endometrial hypoplasia, non-human animal			
MONDO:1016981	fetal death due to EHV-1, non-human animal			
MONDO:1016982	fetal death due to equine viral arteritis, non-human animal			
MONDO:1016983	fetal death due to twin pregnancy, non-human animal			
MONDO:1016984	fetal death due to umbilical torsion, non-human animal			
MONDO:1016985	fetal mummification, non-human animal			
MONDO:1016986	hemospermia, non-human animal			
MONDO:1016987	hydroallantois, non-human animal			
MONDO:1016988	hydrops amnion, non-human animal			
MONDO:1016989	hypocalcaemic tetany, non-human animal			
MONDO:1016990	impotence, non-human animal			
MONDO:1016991	chronic mastitis, non-human animal			
MONDO:1016992	infectious mastitis, non-human animal			
MONDO:1016993	fungal mastitis, non-human animal			
MONDO:1016994	yeast mastitis, non-human animal			
MONDO:1016995	oviduct obstruction, non-human animal			
MONDO:1016996	perineal laceration, non-human animal			
MONDO:1016997	first degree perineal laceration, non-human animal			
MONDO:1016998	second degree perineal laceration, non-human animal			
MONDO:1016999	third degree perineal laceration, non-human animal			
MONDO:1017000	placentitis, non-human animal			
MONDO:1017001	post-parturient hemoglobinuria, non-human animal			
MONDO:1017002	premature placental separation, non-human animal			
MONDO:1017003	pregnancy-related prepubic tendon rupture, non-human animal			
MONDO:1017004	retained fetal membranes, non-human animal			
MONDO:1017005	post-partum uterine prolapse, non-human animal			
MONDO:1017006	hypersexuality, non-human animal			
MONDO:1017007	nymphomania, non-human animal			
MONDO:1017008	mucometra, non-human animal			
MONDO:1017009	hydrometra, non-human animal			
MONDO:1017010	infectious abortion, non-human animal			
MONDO:1017011	infectious abortion, bacterial, non-human animal			
MONDO:1017012	infectious abortion, fungal, non-human animal			
MONDO:1017013	infectious abortion, viral, non-human animal			
MONDO:1017014	ampullary blockage, non-human animal			
MONDO:1017016	generalised placentitis, non-human animal			
MONDO:1017017	localised placentitis, non-human animal			
MONDO:1017018	anovulatory follicle, non-human animal			
MONDO:1017019	spermatic cord varicoele, non-human animal			
MONDO:1017020	urinary incontinence - post-foaling, non-human animal			
MONDO:1017021	urospermia, non-human animal			
MONDO:1017022	uterine tear, non-human animal			
MONDO:1017023	uterine torsion, non-human animal			
MONDO:1017024	non-umbilical hemorrhage abortion/fetal death, non-human animal			
MONDO:1017025	umbilical hemorrhage abortion/fetal death, non-human animal			
MONDO:1017026	intra-uterine growth retardation abortion/fetal death, non-human animal			
MONDO:1017027	abortion/fetal death - premature birth, non-human animal			
MONDO:1017028	congenital malformation abortion/fetal death, non-human animal			
MONDO:1017029	Aspergilis abortion/fetal death, non-human animal			
MONDO:1017030	Bacillus licheniformis abortion/fetal death, non-human animal			
MONDO:1017031	Chlamydophila abortus abortion/fetal death, non-human animal			
MONDO:1017032	Coxiella burnetii abortion/fetal death, non-human animal			
MONDO:1017033	E. coli abortion/fetal death, non-human animal			
MONDO:1017034	Leptospira hardjo abortion/fetal death, non-human animal			
MONDO:1017035	Leptospira pomona abortion/fetal death, non-human animal			
MONDO:1017036	Salmonella abortion/fetal death, non-human animal			
MONDO:1017037	Salmonella dublin abortion/fetal death, non-human animal			
MONDO:1017038	Salmonella montevideo abortion/fetal death, non-human animal			
MONDO:1017039	Salmonella typhimurium abortion/fetal death, non-human animal			
MONDO:1017040	Staphylococus abortion/fetal death, non-human animal			
MONDO:1017041	Streptococcus abortion/fetal death, non-human animal			
MONDO:1017042	Trueperella pyogenes abortion/fetal death, non-human animal			
MONDO:1017043	Yersinia sp abortion/fetal death, non-human animal			
MONDO:1017044	Neospora abortion/fetal death, non-human animal			
MONDO:1017045	Toxoplasma gondii abortion/fetal death, non-human animal			
MONDO:1017046	BVD abortion/fetal death, non-human animal			
MONDO:1017047	IBR abortion/fetal death, non-human animal			
MONDO:1017048	Schmallenberg virus infection abortion/fetal death, non-human animal			
MONDO:1017049	hemorrhage - vaginal artery complication of parturition, non-human animal			
MONDO:1017050	bradytocia dystocia, non-human animal			
MONDO:1017051	fetal oversize dystocia, non-human animal			
MONDO:1017052	malpresentation - backwards presentation dystocia, non-human animal			
MONDO:1017053	malpresentation - breech dystocia, non-human animal			
MONDO:1017054	malpresentation - congenital abnormaity calf dystocia, non-human animal			
MONDO:1017055	malpresentation - front leg back x 1 dystocia, non-human animal			
MONDO:1017056	malpresentation - front leg back x 2 dystocia, non-human animal			
MONDO:1017057	malpresentation - head back dystocia, non-human animal			
MONDO:1017058	malpresentation - twins dystocia, non-human animal			
MONDO:1017059	malpresentation - upside down dystocia, non-human animal			
MONDO:1017060	vaginitis granular vulvo, non-human animal			
MONDO:1017061	infectious pustular vulvovaginitis / infectious balanoposthitis, non-human animal			
MONDO:1017062	Bacillus cereus mastitis, non-human animal			
MONDO:1017063	Bacillus spp mastitis, non-human animal			
MONDO:1017064	Coryebacterium bovis mastitis, non-human animal			
MONDO:1017065	E. coli mastitis, non-human animal			
MONDO:1017066	gangrenous mastitis, non-human animal			
MONDO:1017067	Listeria sp. mastitis, non-human animal			
MONDO:1017068	Mannheimia haemolytica mastitis, non-human animal			
MONDO:1017069	Serratia spp mastitis, non-human animal			
MONDO:1017070	subclinical mastitis, non-human animal			
MONDO:1017071	toxic mastitis, non-human animal			
MONDO:1017072	Trueperella pyogenes mastitis, non-human animal			
MONDO:1017073	post calving paralysis, non-human animal			
MONDO:1017074	obturator nerve post calving paralysis, non-human animal			
MONDO:1017075	peroneal nerve post calving paralysis, non-human animal			
MONDO:1017076	sciatic nerve post calving paralysis, non-human animal			
MONDO:1017077	tibial nerve post calving paralysis, non-human animal			
MONDO:1017078	coiled principle piece sperm abnormality, non-human animal			
MONDO:1017079	dag defect sperm abnormality, non-human animal			
MONDO:1017080	detached heads sperm abnormality, non-human animal			
MONDO:1017081	distal cytoplasmic defects sperm abnormality, non-human animal			
MONDO:1017082	distal midpeice reflex / bent tail sperm abnormality, non-human animal			
MONDO:1017083	knobbed acrosome defect sperm abnormality, non-human animal			
MONDO:1017084	mitochondrial sheath defects sperm abnormality, non-human animal			
MONDO:1017086	proximal cytoplasmic droplets sperm abnormality, non-human animal			
MONDO:1017087	pyriform / tapered heads sperm abnormality, non-human animal			
MONDO:1017088	iodine deficiency stillbirth, non-human animal			
MONDO:1017089	selenium deficiency stillbirth, non-human animal			
MONDO:1017090	stillbirth after stage 2 labor, non-human animal			
MONDO:1017091	stillbirth during stage 2 labor, non-human animal			
MONDO:1017092	uterine atresia, non-human animal			
MONDO:1017093	delayed uterine involution, non-human animal			
MONDO:1017094	mating-induced endometritis, non-human animal			
MONDO:1017095	transient endometritis, non-human animal			
MONDO:1017096	psychological infertility, non-human animal			
MONDO:1017097	uterine cyst, non-human animal			
MONDO:1017098	uterine dorsoretroflexion, non-human animal			
MONDO:1017099	uterine horn inversion, non-human animal			
MONDO:1017100	uterine inertia, non-human animal			
MONDO:1017101	uterine rupture, non-human animal			
MONDO:1017102	persistent vaginitis, non-human animal			
MONDO:1017103	fibrosing alveolitis, non-human animal			
MONDO:1017104	acute bronchitis, non-human animal			
MONDO:1017105	allergic bronchitis, non-human animal			
MONDO:1017106	bulla of lung, non-human animal			
MONDO:1017107	canine chronic bronchitis/obstructive airway disease			
MONDO:1017108	cat flu, non-human animal			
MONDO:1017109	chronic airway disease, non-human animal			
MONDO:1017112	elongated soft palate, non-human animal			
MONDO:1017113	feline asthma			
MONDO:1017114	canine infectious tracheobronchitis			
MONDO:1017115	laryngeal collapse, non-human animal			
MONDO:1017116	laryngeal obstruction, non-human animal			
MONDO:1017117	hemiplegic laryngeal paralysis, non-human animal			
MONDO:1017118	laryngeal paresis, non-human animal			
MONDO:1017119	infectious laryngitis, non-human animal			
MONDO:1017120	lung lobe torsion, non-human animal			
MONDO:1017121	laryngeal mass lesion, non-human animal			
MONDO:1017122	frontal nasal sinus mass lesion, non-human animal			
MONDO:1017123	nose mass lesion, non-human animal			
MONDO:1017124	nasal cavity mass lesion, non-human animal			
MONDO:1017126	pulmonary mass lesion, non-human animal			
MONDO:1017128	tracheal mass lesion, non-human animal			
MONDO:1017129	congenital nasal disorder, non-human animal			
MONDO:1017131	nasal infection, non-human animal			
MONDO:1017132	nasal obstruction, non-human animal			
MONDO:1017133	nasal sinus obstruction, non-human animal			
MONDO:1017134	nasal sinus neoplasm, non-human animal			
MONDO:1017135	frontal nasal sinus neoplasm, non-human animal			
MONDO:1017136	nose neoplasm, non-human animal			
MONDO:1017137	nasal cavity neoplasm, non-human animal			
MONDO:1017138	neoplastic metastasis to lung, non-human animal			
MONDO:1017143	bronchopneumonia, non-human animal	Bronchopneumonia that occurs in non-human animals.		
MONDO:1017144	interstitial pneumonia, non-human animal			
MONDO:1017145	lobar pneumonia, non-human animal			
MONDO:1017146	non-infectious pneumonia, non-human animal			
MONDO:1017147	parasitic pneumonia, non-human animal			
MONDO:1017148	pneumonia due to pneumocystis carinii infection, non-human animal			
MONDO:1017149	uremic pneumonitis, non-human animal			
MONDO:1017150	laryngeal polyp, non-human animal			
MONDO:1017152	pulmonary contusion, non-human animal			
MONDO:1017153	non-cardiogenic pulmonary edema, non-human animal			
MONDO:1017154	bacterial respiratory tract infection, non-human animal			
MONDO:1017155	fungal respiratory tract infection, non-human animal			
MONDO:1017156	parasitic respiratory tract infection, non-human animal			
MONDO:1017157	lower respiratory tract infection, non-human animal			
MONDO:1017159	lower respiratory tract obstruction, non-human animal			
MONDO:1017160	upper respiratory tract obstruction, non-human animal			
MONDO:1017161	reverse sneezing, non-human animal			
MONDO:1017162	lymphoplasmacytic rhinitis, non-human animal			
MONDO:1017163	infectious bacterial rhinitis, non-human animal			
MONDO:1017164	infectious fungal rhinitis, non-human animal			
MONDO:1017165	infectious viral rhinitis, non-human animal			
MONDO:1017166	smoke inhalation, non-human animal			
MONDO:1017167	bronchus squamous cell carcinoma, non-human animal			
MONDO:1017168	stenotic nares, non-human animal			
MONDO:1017170	tracheal avulsion, non-human animal			
MONDO:1017171	tracheal collapse, non-human animal			
MONDO:1017172	acquired tracheal collapse, non-human animal			
MONDO:1017173	congenital tracheal collapse, non-human animal			
MONDO:1017174	tracheal perforation, non-human animal			
MONDO:1017175	iatrogenic tracheal perforation, non-human animal			
MONDO:1017176	tracheal rupture, non-human animal			
MONDO:1017177	acquired tracheal stenosis, non-human animal			
MONDO:1017178	congenital tracheal stenosis, non-human animal	Congenital tracheal stenosis that occurs in non-human animals.		
MONDO:1017179	tracheal obstruction, non-human animal			
MONDO:1017180	acute tracheobronchitis, non-human animal			
MONDO:1017181	chronic tracheobronchitis, non-human animal			
MONDO:1017182	ventilatory failure, non-human animal			
MONDO:1017184	eosinophilic bronchopneumopathy, non-human animal			
MONDO:1017185	tracheal adenocarcinoma, non-human animal			
MONDO:1017186	nasal cavity fibrosarcoma, non-human animal			
MONDO:1017190	nasal sinus mass lesion, non-human animal			
MONDO:1017191	infectious pneumonia, non-human animal			
MONDO:1017192	alar fold disease, non-human animal			
MONDO:1017193	redundant alar fold disease, non-human animal			
MONDO:1017194	alar fold hypertrophy/enlargement disease, non-human animal			
MONDO:1017195	arytenoid chondritis, non-human animal			
MONDO:1017196	arytenoid granuloma, non-human animal			
MONDO:1017197	nasal atheroma, non-human animal			
MONDO:1017198	axial deviation of aryepiglottic folds, non-human animal			
MONDO:1017199	pulmonary botryomycosis, non-human animal			
MONDO:1017200	bronchopleural fistula, non-human animal			
MONDO:1017201	contagious equine pleuropneumonia			
MONDO:1017202	nasal sinus empyema, non-human animal			
MONDO:1017203	epiglottic deformity, non-human animal			
MONDO:1017204	epiglottic entrapment, non-human animal			
MONDO:1017205	epiglottic hypoplasia/flaccidity, non-human animal			
MONDO:1017206	epiglottic retroversion, non-human animal			
MONDO:1017207	inflammatory airway disease, non-human animal			
MONDO:1017208	acquired laryngeal paralysis, non-human animal			
MONDO:1017209	idiopathic laryngeal paralysis, non-human animal			
MONDO:1017210	laryngeal scarification, non-human animal			
MONDO:1017211	post-operative laryngeal scarification, non-human animal			
MONDO:1017212	caudal maxillary nasal sinus mass lesion, non-human animal			
MONDO:1017213	rostral maxillary nasal sinus mass lesion, non-human animal			
MONDO:1017214	sphenopalatine nasal sinus mass lesion, non-human animal			
MONDO:1017216	nasal septal disorder, non-human animal			
MONDO:1017217	nasal sinus cyst, non-human animal			
MONDO:1017229	bacterial pleuropneumonia, non-human animal			
MONDO:1017230	protozoal pneumonia, non-human animal			
MONDO:1017231	inclusion body rhinitis, non-human animal			
MONDO:1017232	rhodococcus equi pneumonia, non-human animal			
MONDO:1017233	rostral displacement of the palatopharyngeal arch, non-human animal			
MONDO:1017234	acute sinusitis, non-human animal			
MONDO:1017235	primary sinusitis, non-human animal			
MONDO:1017236	secondary sinusitis, non-human animal			
MONDO:1017238	caudal maxillary sinusitis, non-human animal			
MONDO:1017239	frontal sinus sinusitis, non-human animal			
MONDO:1017240	rostral maxillary sinusitis, non-human animal			
MONDO:1017241	sphenopalatine sinusitis, non-human animal			
MONDO:1017242	asphyxiation, non-human animal			
MONDO:1017243	drowned/near drowning, non-human animal			
MONDO:1017244	pulmonary bleb, non-human animal			
MONDO:1017245	pulmonary bulla, non-human animal			
MONDO:1017246	pulmonary atelectasis, non-human animal			
MONDO:1017247	alar fold hypertrophy/enlargement, non-human animal			
MONDO:1017248	redundant alar fold, non-human animal			
MONDO:1017249	alar fold collapse, non-human animal			
MONDO:1017250	alar fold stenosis, non-human animal			
MONDO:1017251	paranasal sinus empyema, non-human animal			
MONDO:1017252	paranasal sinus mass lesion, non-human animal			
MONDO:1017253	frontal paranasal sinus mass lesion, non-human animal			
MONDO:1017254	conchal necrosis, non-human animal			
MONDO:1017256	rhodococcal bacterial pneumonia, non-human animal			
MONDO:1017257	ventral conchal sinusitis, non-human animal			
MONDO:1017258	summer pasture associated obstructive pulmonary disease, non-human animal			
MONDO:1017259	tracheal granuloma, non-human animal			
MONDO:1017261	laryngeal chondritis, non-human animal			
MONDO:1017262	Muellerius capillaris parasitic pneumonia, non-human animal			
MONDO:1017263	infectious bovine rhinotracheitis viral pneumonia, non-human animal			
MONDO:1017264	parainfluenza-3 viral pneumonia, non-human animal			
MONDO:1017265	RSV viral pneumonia, non-human animal			
MONDO:1017267	laryngeal foreign body, non-human animal			
MONDO:1017268	guttural pouch melanoma, non-human animal			
MONDO:1017269	nasal mycosis, non-human animal			
MONDO:1017270	guttural pouch neoplasm, non-human animal			
MONDO:1017271	pleural fibrosis, non-human animal			
MONDO:1017272	fungal pneumonia, non-human animal			
MONDO:1017273	recurrent laryngeal neuropathy, non-human animal			
MONDO:1017274	rhinitis sicca, non-human animal			
MONDO:1017275	sinus empyema, non-human animal			
MONDO:1017276	caudal maxillary sinus empyema, non-human animal			
MONDO:1017277	frontal sinus empyema, non-human animal			
MONDO:1017278	rostral maxillary sinus empyema, non-human animal			
MONDO:1017279	sphenopalatine sinus empyema, non-human animal			
MONDO:1017280	ventral conchal sinus empyema, non-human animal			
MONDO:1017281	fungal sinusitis, non-human animal			
MONDO:1017282	tracheal trauma, non-human animal			
MONDO:1017283	air sacculitis, non-human animal			
MONDO:1017284	fungal air sacculitis, non-human animal			
MONDO:1017285	bacterial air sacculitis, non-human animal			
MONDO:1017286	canine acne			
MONDO:1017287	feline acne			
MONDO:1017288	juvenile acne, non-human animal			
MONDO:1017289	acral lick dermatitis, non-human animal			
MONDO:1017290	acral mutilation, non-human animal			
MONDO:1017291	alopecia areata/pseudopelade, non-human animal			
MONDO:1017292	alopecia x, non-human animal			
MONDO:1017293	alopecia/hair coat abnormality, non-human animal			
MONDO:1017294	glucocorticoid-induced alopecia/hair coat abnormality, non-human animal			
MONDO:1017295	injection-induced alopecia/hair coat abnormality, non-human animal			
MONDO:1017296	callus, non-human animal			
MONDO:1017297	chemical injury to skin, non-human animal			
MONDO:1017298	claw injury, non-human animal			
MONDO:1017299	color dilution alopecia, non-human animal			
MONDO:1017300	color mutant alopecia, non-human animal			
MONDO:1017301	cornification disorder, non-human animal			
MONDO:1017302	cutaneous horn, non-human animal			
MONDO:1017303	cyclic flank alopecia, non-human animal			
MONDO:1017304	chronic dermatitis, non-human animal			
MONDO:1017305	contagious viral pustular dermatitis, non-human animal			
MONDO:1017306	perforating dermatitis, non-human animal			
MONDO:1017307	pyotraumatic dermatitis, non-human animal			
MONDO:1017308	solar dermatitis, non-human animal			
MONDO:1017309	thymoma-associated exfoliative dermatitis, non-human animal			
MONDO:1017310	granulomatous bacterial dermatitis and/or panniculitis, non-human animal			
MONDO:1017311	granulomatous fungal dermatitis and/or panniculitis, non-human animal			
MONDO:1017312	granulomatous sterile dermatitis and/or panniculitis, non-human animal			
MONDO:1017313	dermatophilosis, non-human animal			
MONDO:1017314	dermoid sinus, non-human animal			
MONDO:1017315	ear margin dermatosis, non-human animal			
MONDO:1017316	effluvium, anagen or telogen, non-human animal			
MONDO:1017317	eosinophilic plaque, non-human animal			
MONDO:1017318	feline eosinophilic granuloma complex			
MONDO:1017319	feline ulcerative dermatitis			
MONDO:1017320	fibropruritic nodule, non-human animal			
MONDO:1017322	follicular cornification disorder, non-human animal			
MONDO:1017323	follicular dysplasia, non-human animal			
MONDO:1017324	muzzle folliculitis and furunculosis, non-human animal			
MONDO:1017325	pyotraumatic folliculitis and furunculosis, non-human animal			
MONDO:1017326	footpad hyperkeratosis, non-human animal			
MONDO:1017327	furunculosis, non-human animal	Furunculosis that occurs in non-human animals.		
MONDO:1017328	hair shaft abnormality, non-human animal			
MONDO:1017329	allergic angioedema, non-human animal			
MONDO:1017330	contact hypersensitivity skin disorder, non-human animal			
MONDO:1017331	eosinophilic furunculosis of the face, non-human animal			
MONDO:1017332	flea bite hypersensitivity skin disorder, non-human animal			
MONDO:1017333	food hypersensitivity skin disorder, non-human animal			
MONDO:1017334	mast cell-rich papular allergic dermatitis, non-human animal			
MONDO:1017335	mosquito bite hypersensitivity skin disorder, non-human animal			
MONDO:1017336	idiopathic facial dermatitis, non-human animal			
MONDO:1017337	idiopathic lymphocytic mural folliculitis, non-human animal			
MONDO:1017338	idiopathic seborrhoea, non-human animal			
MONDO:1017339	interdigital cyst, non-human animal			
MONDO:1017340	interdigital pyogranulomas, non-human animal			
MONDO:1017341	juvenile cellulitis/pyoderma, non-human animal			
MONDO:1017342	lichenoid dermatosis, non-human animal			
MONDO:1017343	malassezia dermatitis, non-human animal			
MONDO:1017344	cutaneous mass lesion, non-human animal			
MONDO:1017345	perianal skin mass lesion, non-human animal			
MONDO:1017346	German Shepherd Dog metatarsal fistulae, non-human animal			
MONDO:1017347	German Shepherd Dog multiple collagenous naevi, non-human animal			
MONDO:1017348	nasal hyperkeratosis, non-human animal			
MONDO:1017349	cutaneous epithelial neoplasm, non-human animal			
MONDO:1017350	perianal gland neoplasm, non-human animal			
MONDO:1017351	perianal skin neoplasm, non-human animal			
MONDO:1017352	idiopathic onychodystrophy, non-human animal			
MONDO:1017353	symmetric lupoid onychodystrophy, non-human animal			
MONDO:1017354	onychodystrophy, non-human animal			
MONDO:1017355	idiopathic onychomadesis, non-human animal			
MONDO:1017356	paraneoplastic alopecia, non-human animal			
MONDO:1017357	bacterial paronychia, non-human animal			
MONDO:1017358	fungal paronychia, non-human animal			
MONDO:1017359	pattern baldness, non-human animal			
MONDO:1017360	pemphigus disorder, non-human animal			
MONDO:1017361	pinnal alopecia, non-human animal			
MONDO:1017362	pododermatitis, non-human animal			
MONDO:1017363	infectious pododermatitis, non-human animal			
MONDO:1017364	plasma cell pododermatitis, non-human animal			
MONDO:1017365	post-clipping alopecia, non-human animal			
MONDO:1017366	preauricular alopecia, non-human animal			
MONDO:1017367	psychogenic dermatosis, non-human animal			
MONDO:1017368	botryomycotic pyoderma, non-human animal			
MONDO:1017369	deep pyoderma, non-human animal			
MONDO:1017370	mucocutaneous pyoderma, non-human animal			
MONDO:1017371	superficial pyoderma, non-human animal			
MONDO:1017372	Schnauzer dog comedo syndrome			
