mondo_id	label	definition	obsolete	obsoletion_candidate
MONDO:0100468	Batten-Turner congenital myopathy	A congenital myopathy described by Batten (1910) and later Turner (1949) and Turner and Lees (1962) in which a family of 6 siblings presented in infancy the picture of 'amyotonia congenita' and later in life a nonprogressive myopathy.		
MONDO:0100470	reactive airway disease	Coughing, wheezing, or shortness of breath that is triggered by allergens, infection, or other irritants.		
MONDO:0100471	vitamin D deficiency	Abnormally low level of 25-hydroxyvitamin D in the blood.		
MONDO:0700118	proximal chromosome 18q deletion syndrome	Chromosome abnormality that occurs when there is a missing (deleted) copy of genetic material from the part of the long (q) arm near the center of chromosome 18.		
MONDO:0700119	distal chromosome 18q deletion syndrome	Distal chromosome 18q deletion syndrome is a chromosome abnormality that occurs when there is a missing (deleted) copy of genetic material at the end of the long arm (q) of chromosome 18.		
MONDO:0700120	BAFopathy	Disorder caused by mutations in the various subunits composing the BAF complex.		
MONDO:0700121	ACTL6A-related BAFopathy	Any BAFopathy in which the cause of the disease is a mutation in the ACTL6A gene.		
MONDO:0700122	PBRM1-related BAFopathy	Any BAFopathy in which the cause of the disease is a mutation in the PBRM1 gene.		
MONDO:0700123	SMARCC1-related BAFopathy	Any BAFopathy in which the cause of the disease is a mutation in the SMARCC1 gene.		
