mondo_id	property	value_old	value_new
MONDO:0000218	label	preimplantation embryonic lethality	obsolete preimplantation embryonic lethality
MONDO:0004736	label	inherited amino acid metabolic disorder	inborn disorder of amino acid metabolism
MONDO:0000601	label	autoimmune disorder of urogenital tract	obsolete autoimmune disorder of urogenital tract
MONDO:0000688	label	inherited organic acidemia	inborn organic aciduria
MONDO:0002412	label	glycogen storage disease	disorder of glycogen metabolism
MONDO:0024255	label	genetic skin disease	obsolete genetic skin disease
MONDO:0003998	label	vaginal tubular adenoma	obsolete vaginal tubular adenoma
MONDO:0004978	label	aortic stenosis	obsolete aortic stenosis
MONDO:0005410	label	acute graft vs. host disease	obsolete acute graft vs. host disease
MONDO:0006657	label	apparent mineralocorticoid excess syndrome	obsolete apparent mineralocorticoid excess syndrome
MONDO:0019285	label	syndromic nail anomaly	obsolete syndromic nail anomaly
MONDO:0019721	label	syndromic renal or urinary tract malformation	obsolete syndromic renal or urinary tract malformation
MONDO:0019117	label	genetic nervous system disorder	obsolete genetic nervous system disorder
MONDO:0020208	label	syndromic myopia	obsolete syndromic myopia
MONDO:0015163	label	primary glomerular disease	obsolete primary glomerular disease
MONDO:0008085	label	neuropathy, hereditary sensorimotor, with upper motor neuron, visual pathway and autonomic disturbance	obsolete neuropathy, hereditary sensorimotor, with upper motor neuron, visual pathway and autonomic disturbance
MONDO:0008370	label	reticular dystrophy of retinal pigment epithelium	obsolete reticular dystrophy of retinal pigment epithelium
MONDO:0015953	label	genetic central nervous system and retinal vascular disease	obsolete genetic central nervous system and retinal vascular disease
MONDO:0020676	label	disorder of central nervous system or retinal vasculature	obsolete disorder of central nervous system or retinal vasculature
MONDO:0019589	label	syndromic genetic hearing loss	obsolete syndromic genetic hearing loss
MONDO:0019216	label	inborn disorder of amino acid absorption and transport	inborn disorder of amino acid transport
MONDO:0019833	label	pituitary hormone deficiency from tumoral origin	obsolete pituitary hormone deficiency from tumoral origin
MONDO:0043007	label	genetic multiple congenital anomalies/dysmorphic syndrome-variable intellectual disability syndrome	obsolete genetic multiple congenital anomalies/dysmorphic syndrome-variable intellectual disability syndrome
MONDO:0017706	label	disorder of carbohydrate absorption and transport	disorder of carbohydrate transmembrane transport and absorption
MONDO:0019225	label	gluconeogenesis disorder	disorder of gluconeogenesis
MONDO:0009827	label	pachyonychia congenita, autosomal recessive	obsolete pachyonychia congenita, autosomal recessive
MONDO:0010078	label	spondyloperipheral dysplasia-short ulna syndrome	spondyloperipheral dysplasia
MONDO:0019282	label	syndromic hair shaft abnormality	obsolete syndromic hair shaft abnormality
MONDO:0010888	label	endometriosis of uterus	adenomyosis
MONDO:0016200	label	qualitative or quantitative defects of glucosamine (UDP-N-acetyl)-2-epimerase/N-acetylmannosamine kinase -	qualitative or quantitative defects of glucosamine (UDP-N-acetyl)-2-epimerase/N-acetylmannosamine kinase
MONDO:0019058	label	neurometabolic disease	obsolete neurometabolic disease
MONDO:0014502	label	mendelian susceptibility to mycobacterial diseases due to complete ISG15 deficiency	Mendelian susceptibility to mycobacterial diseases due to complete ISG15 deficiency
MONDO:0014783	label	preimplantation embryonic lethality 1	obsolete preimplantation embryonic lethality 1
MONDO:0018609	label	syndromic hereditary optic neuropathy	obsolete syndromic hereditary optic neuropathy
MONDO:0014978	label	preimplantation embryonic lethality 2	obsolete preimplantation embryonic lethality 2
MONDO:0043008	label	genetic multiple congenital anomalies/dysmorphic syndrome without intellectual disability	obsolete genetic multiple congenital anomalies/dysmorphic syndrome without intellectual disability
MONDO:0016110	label	non-dystrophic myopathy	obsolete non-dystrophic myopathy
MONDO:0016182	label	qualitative or quantitative defects of protein O-mannose beta1,2N-acetylglucosaminyltransferase	qualitative or quantitative defects of protein O-mannose beta1, 2N-acetylglucosaminyltransferase
MONDO:0016454	label	severe early-onset axonal neuropathy due to NEFL deficiency	Charcot-Marie-Tooth disease type 2B5
MONDO:0017143	label	genetic infertility	obsolete genetic infertility
MONDO:0019235	label	inborn disorder of phenylalanin or tyrosine metabolism	inborn disorder of phenylalanine and tyrosine metabolism
MONDO:0019223	label	inborn disorder of fatty acid oxidation and ketone body metabolism	disorder of fatty acid and ketone body metabolism
MONDO:0017900	label	autosomal recessive mendelian susceptibility to mycobacterial diseases due to complete IFNgammaR2 deficiency	autosomal recessive Mendelian susceptibility to mycobacterial diseases due to complete IFNgammaR2 deficiency
MONDO:0018787	label	genetic cerebral small vessel disease	obsolete genetic cerebral small vessel disease
MONDO:0019843	label	pituitary hormone deficiency secondary to a granulomatous disease	obsolete pituitary hormone deficiency secondary to a granulomatous disease
MONDO:0019601	label	autosomal recessive axonal hereditary motor and sensory neuropathy	obsolete autosomal recessive axonal hereditary motor and sensory neuropathy
MONDO:0019834	label	pituitary hormone deficiency from meningeal origin	obsolete pituitary hormone deficiency from meningeal origin
MONDO:0019841	label	pituitary hormone defiency from vascular origin	obsolete pituitary hormone defiency from vascular origin
MONDO:0020225	label	syndromic cataract	obsolete syndromic cataract
MONDO:0020503	label	resistance to thyrotropin-releasing hormone syndrome	obsolete resistance to thyrotropin-releasing hormone syndrome
MONDO:0021027	label	genetic hair anomaly	obsolete genetic hair anomaly
MONDO:0021028	label	genetic nail anomaly	obsolete genetic nail anomaly
MONDO:0022018	label	Borrone di Rocco Crovato syndrome	obsolete Borrone di Rocco Crovato syndrome
MONDO:0022620	label	CD4 deficiency	obsolete CD4 deficiency
MONDO:0022880	label	corticobasal degeneration	obsolete corticobasal degeneration
MONDO:0043005	label	genetic multiple congenital anomalies/dysmorphic syndrome	obsolete genetic multiple congenital anomalies/dysmorphic syndrome
MONDO:0044331	label	genetic transient congenital hypothyroidism	obsolete genetic transient congenital hypothyroidism
MONDO:0000155	definition	An acquired metabolic disease that is has its basis in the disruption of sequestering of triglyceride.	An inherited metabolic disease that is has its basis in the disruption of sequestering of triglyceride.
MONDO:0019226	definition	An acquired metabolic disease that is has its basis in the disruption of glucose transport.	An inherited metabolic disease that is has its basis in the disruption of glucose transport.
MONDO:0000273	definition		A West Nile encephalitis that results in infection located in brain, has material basis in Kunjin virus, a subtype of West Nile Virus, which is transmitted by Culex annulirostris mosquito bite. The infection has symptom fever, has symptom rigor, has symptom headache, has symptom confusion, and has symptom lethargy.
MONDO:0000351	definition	An acquired metabolic disease that is has its basis in the disruption of methionine catabolic process.	An inherited metabolic disease that is has its basis in the disruption of methionine catabolic process.
MONDO:0019222	definition	An acquired metabolic disease that is has its basis in the disruption of sulfur amino acid metabolic process.	An inherited metabolic disease that is has its basis in the disruption of sulfur amino acid metabolic process.
MONDO:0037938	definition	An acquired metabolic disease that is has its basis in the disruption of aspartate family amino acid metabolic process.	An inherited metabolic disease that is has its basis in the disruption of aspartate family amino acid metabolic process.
MONDO:0000421	definition	An acquired metabolic disease that is has its basis in the disruption of L-serine biosynthetic process.	An inherited metabolic disease that is has its basis in the disruption of L-serine biosynthetic process.
MONDO:0019239	definition	An acquired metabolic disease that is has its basis in the disruption of serine family amino acid metabolic process.	An inherited metabolic disease that is has its basis in the disruption of serine family amino acid metabolic process.
MONDO:0005528	definition	An acquired metabolic disease that is has its basis in the disruption of vitamin metabolic process.	An inherited metabolic disease that is has its basis in the disruption of vitamin metabolic process.
MONDO:0019243	definition	An acquired metabolic disease that is has its basis in the disruption of generation of precursor metabolites and energy.	An inherited metabolic disease that is has its basis in the disruption of generation of precursor metabolites and energy.
MONDO:0000601	definition	A hypersensitivity reaction type II disease that involves the genitourinary system.	OBSOLETE. A hypersensitivity reaction type II disease that involves the genitourinary system.
MONDO:0019224	definition	An acquired metabolic disease that is has its basis in the disruption of gamma-aminobutyric acid metabolic process.	An inherited metabolic disease that is has its basis in the disruption of gamma-aminobutyric acid metabolic process.
MONDO:0045046	definition	An acquired metabolic disease that is has its basis in the disruption of thyroid hormone metabolic process.	An inherited metabolic disease that is has its basis in the disruption of thyroid hormone metabolic process.
MONDO:0019214	definition	An acquired metabolic disease that is has its basis in the disruption of carbohydrate metabolic process.	An inherited metabolic disease that is has its basis in the disruption of carbohydrate metabolic process.
MONDO:0024255	definition	An instance of skin disease that is caused by a modification of the individual's genome.	OBSOLETE. An instance of skin disease that is caused by a modification of the individual's genome.
MONDO:0003998	definition	An adenoma that arises from the vagina and is characterized by a tubular architectural pattern.	OBSOLETE. An adenoma that arises from the vagina and is characterized by a tubular architectural pattern.
MONDO:0005410	definition	Graft-versus-host disease (GVHD) is a common complication following an allogeneic tissue transplant. It is commonly associated with stem cell or bone marrow transplant but the term also applies to other forms of tissue graft.	
MONDO:0006657	definition	An autosomal recessive disorder caused by a deficiency of 11-beta-hydroxysteroid dehydrogenase, which is characterized by hypertension, hypokalemia, low renin, and hypoaldosteronism.	
MONDO:0019236	definition	An acquired metabolic disease that is has its basis in the disruption of purine nucleobase metabolic process.	An inherited metabolic disease that is has its basis in the disruption of purine nucleobase metabolic process.
MONDO:0016789	definition	An acquired metabolic disease that is has its basis in the disruption of pyruvate metabolic process.	An inherited metabolic disease that is has its basis in the disruption of pyruvate metabolic process.
MONDO:0019285	definition	A nail anomaly that is part of a larger syndrome.	OBSOLETE. A nail anomaly that is part of a larger syndrome.
MONDO:0017762	definition	An acquired metabolic disease that is has its basis in the disruption of cellular copper ion homeostasis.	An inherited metabolic disease that is has its basis in the disruption of cellular copper ion homeostasis.
MONDO:0007481	definition	LC)ri-Weill dyschondrosteosis (LWD) is a skeletal dysplasia marked by disproportionate short stature and the characteristic Madelung wrist deformity.	Leri-Weill dyschondrosteosis (LWD) is a skeletal dysplasia marked by disproportionate short stature and the characteristic Madelung wrist deformity.
MONDO:0019721	definition	A renal or urinary tract malformation that is part of a larger syndrome.	OBSOLETE. A renal or urinary tract malformation that is part of a larger syndrome.
MONDO:0019117	definition	An instance of nervous system disease that is caused by a modification of the individual's genome.	OBSOLETE. An instance of nervous system disease that is caused by a modification of the individual's genome.
MONDO:0007646	definition	Autosomal recessive axonal neuropathy with neuromyotonia is a rare peripheral neuropathy characterized by slowly progressive axonal, motor greater than sensory polyneuropathy combined with neuromytonia (including spontaneous muscular activity at rest (myokymia), impaired muscle relaxation (pseudomyotonia), and contractures of hands and feet) and neuromyotonic or myokymic discharges on needle EMG. It presents with distal lower limb weakness with gait impairment, muscle stiffness, fasciculations and cramps in hands and legs worsened by cold, decreased to absent tendon reflexes, intrinsic hand muscle atrophy and, variably, mild distal sensory impairment.	A rare peripheral neuropathy characterized by slowly progressive axonal, motor greater than sensory polyneuropathy combined with neuromytonia (including spontaneous muscular activity at rest (myokymia), impaired muscle relaxation (pseudomyotonia), and contractures of hands and feet) and neuromyotonic or myokymic discharges on needle EMG. It presents with distal lower limb weakness with gait impairment, muscle stiffness, fasciculations and cramps in hands and legs worsened by cold, decreased to absent tendon reflexes, intrinsic hand muscle atrophy and, variably, mild distal sensory impairment.
MONDO:0007921	definition	Yellow nail syndrome (YNS) is a very rare syndromic disorder characterized by the variable triad of characteristic yellow nails, chronic respiratory manifestations, and primary lymphedema.	A very rare syndromic disorder characterized by the variable triad of characteristic yellow nails, chronic respiratory manifestations, and primary lymphedema.
MONDO:0020208	definition	A myopia (disease) that is part of a larger syndrome.	OBSOLETE. A myopia (disease) that is part of a larger syndrome.
MONDO:0008469	definition	Spondyloepimetaphyseal dysplasia-hypotrichosis syndrome is a rare primary bone dysplasia disorder characterized by congenital hypotrichosis associated with rhizomelic short stature (more pronounced in upper limbs than lower limbs), limited hip abduction and mild genu varum. Flared and irregular metaphyses, delayed and irregular epiphiseal ossification and pear-shaped vertebral bodies are characteristic radiologic findings.	A rare primary bone dysplasia disorder characterized by congenital hypotrichosis associated with rhizomelic short stature (more pronounced in upper limbs than lower limbs), limited hip abduction and mild genu varum. Flared and irregular metaphyses, delayed and irregular epiphiseal ossification and pear-shaped vertebral bodies are characteristic radiologic findings.
MONDO:0008471	definition	Spondyloepiphyseal dysplasia congenita (SEDC) is a chondrodysplasia characterized by disproportionate short stature, abnormal epiphyses and flattened vertebral bodies.	A chondrodysplasia characterized by disproportionate short stature, abnormal epiphyses and flattened vertebral bodies.
MONDO:0008476	definition	Spondyloepimetaphyseal dysplasia congenita, Strudwick type is characterized by disproportionate short stature from birth (with a very short trunk and shortened limbs) and skeletal abnormalities (lordosis, scoliosis, flattened vertebrae, pectus carinatum, coxa vara, clubfoot, and abnormal epiphyses or metaphyses).	A spondyloepimetaphyseal dysplasia characterized by disproportionate short stature from birth (with a very short trunk and shortened limbs) and skeletal abnormalities (lordosis, scoliosis, flattened vertebrae, pectus carinatum, coxa vara, clubfoot, and abnormal epiphyses or metaphyses).
MONDO:0016790	definition	An acquired metabolic disease that is has its basis in the disruption of tricarboxylic acid cycle.	An inherited metabolic disease that is has its basis in the disruption of tricarboxylic acid cycle.
MONDO:0019229	definition	An acquired metabolic disease that is has its basis in the disruption of ketone body catabolic process.	An inherited metabolic disease that is has its basis in the disruption of ketone body catabolic process.
MONDO:0008858	definition	Behr syndrome is a disorder characterized by early-onset optic atrophy along with neurological features, including ataxia, spasticity, and intellectual disability. Other signs and symptoms may be present and vary from person to person. This condition is caused by mutations in the OPA1 gene. It is inherited in an autosomal recessive manner. Treatment depends on the specific signs and symptoms seen in the patient.	A disorder characterized by early-onset optic atrophy along with neurological features, including ataxia, spasticity, and intellectual disability. Other signs and symptoms may be present and vary from person to person. This condition is caused by mutations in the OPA1 gene. It is inherited in an autosomal recessive manner. Treatment depends on the specific signs and symptoms seen in the patient.
MONDO:0019240	definition	An acquired metabolic disease that is has its basis in the disruption of sterol biosynthetic process.	An inherited metabolic disease that is has its basis in the disruption of sterol biosynthetic process.
MONDO:0043007	definition	An instance of multiple congenital anomalies/dysmorphic syndrome-variable intellectual disability syndrome that is caused by an inherited modification of the individual's genome.	OBSOLETE. An instance of multiple congenital anomalies/dysmorphic syndrome-variable intellectual disability syndrome that is caused by an inherited modification of the individual's genome.
MONDO:0009196	definition	Cutaneous albinism-ermine phenotype is characterised by the association of white hair with black tufts, depigmented skin and sensorineural deafness. It has been described in two pairs of siblings and one individual case. The depigmentation may present as vitiligo, or be spotted with brown patches. Nystagmus, photophobia, retinal depigmentation and intellectual deficit were also reported in one pair of siblings. An autoimmune mechanism or failure of melanocyte migration may be responsible for the disease.	A rare deafness characterized by the association of bilateral sensorineural hearing loss and white hair with scattered black tufts, as well as skin areas of hyper- and hypopigmentation. Additional reported features include global developmental delay and moderate intellectual disability, growth retardation, microcephaly, hypotonia, mild dysmorphic facial features (deeply set eyes, broad nasal bridge, slight bowing of the upper lip), retinal depigmentation, anomalies of the fingers and toes, and white matter abnormalities on brain imaging.
MONDO:0019225	definition	An acquired metabolic disease that is has its basis in the disruption of gluconeogenesis.	An inherited metabolic disease that is has its basis in the disruption of gluconeogenesis.
MONDO:0040566	definition	An acquired metabolic disease that is has its basis in the disruption of glutathione metabolic process.	An inherited metabolic disease that is has its basis in the disruption of glutathione metabolic process.
MONDO:0017687	definition	An acquired metabolic disease that is has its basis in the disruption of neutral amino acid transport.	An inherited metabolic disease that is has its basis in the disruption of neutral amino acid transport.
MONDO:0019228	definition	An acquired metabolic disease that is has its basis in the disruption of histidine metabolic process.	An inherited metabolic disease that is has its basis in the disruption of histidine metabolic process.
MONDO:0019242	definition	An acquired metabolic disease that is has its basis in the disruption of branched-chain amino acid metabolic process.	An inherited metabolic disease that is has its basis in the disruption of branched-chain amino acid metabolic process.
MONDO:0017350	definition	An acquired metabolic disease that is has its basis in the disruption of tryptophan metabolic process.	An inherited metabolic disease that is has its basis in the disruption of tryptophan metabolic process.
MONDO:0009393	definition	Hyperornithinemia-hyperammonemia-homocitrullinuria syndrome (triple H syndrome) is a disorder of urea cycle metabolism characterized by either a neonatal-onset with manifestations of lethargy, poor feeding, vomiting and tachypnea or, more commonly, presentations in infancy, childhood or adulthood with chronic neurocognitive deficits, acute encephalopathy and/or chronic liver dysfunction.	A rare, genetic disorder of urea cycle metabolism characterized by either a neonatal-onset with manifestations of lethargy, poor feeding, vomiting and tachypnea or, more commonly, presentations in infancy, childhood or adulthood with chronic neurocognitive deficits, acute encephalopathy and/or coagulation defects or other chronic liver dysfunction.
MONDO:0018424	definition	An acquired metabolic disease that is has its basis in the disruption of lipoate biosynthetic process.	An inherited metabolic disease that is has its basis in the disruption of lipoate biosynthetic process.
MONDO:0009579	definition	Frank-ter Haar syndrome (formerly considered as an autosomal recessive form of Melnick-Needles syndrome) is defined by megalocornea, multiple skeletal anomalies, characteristic facial dysmorphism (wide fontanels, prominent forehead, hypertelorism, prominent eyes, full cheeks and micrognathia) and developmental delay.	A syndrome defined by megalocornea, multiple skeletal anomalies, characteristic facial dysmorphism (wide fontanels, prominent forehead, hypertelorism, prominent eyes, full cheeks and micrognathia) and developmental delay.
MONDO:0017356	definition	An acquired metabolic disease that is has its basis in the disruption of ornithine metabolic process.	An inherited metabolic disease that is has its basis in the disruption of ornithine metabolic process.
MONDO:0019237	definition	An acquired metabolic disease that is has its basis in the disruption of pyridoxine metabolic process.	An inherited metabolic disease that is has its basis in the disruption of pyridoxine metabolic process.
MONDO:0010076	definition	Spondyloepimetaphyseal dysplasia, Irapa type is characterized by disproportionate short-trunked short stature, pectus carinatum, short arms, short and broad hands, short metatarsals, flat and broad feet, coxa vara, genu valgum, osteoarthritis, arthrosis and moderate-to-serious gait impairment.	A spondyloepimetaphyseal dysplasia is characterized by disproportionate short-trunked short stature, pectus carinatum, short arms, short and broad hands, short metatarsals, flat and broad feet, coxa vara, genu valgum, osteoarthritis, arthrosis and moderate-to-serious gait impairment.
MONDO:0010077	definition	Spondyloepimetaphyseal dysplasia-short limb-abnormal calcification syndrome is a rare, genetic primary bone dysplasia disorder characterized by disproportionate short stature with shortening of upper and lower limbs, short and broad fingers with short hands, narrowed chest with rib abnormalities and pectus excavatum, abnormal chondral calcifications (incl. larynx, trachea and costal cartilages) and facial dysmorphism (frontal bossing, hypertelorism, prominent eyes, short flat nose, wide nostrils, high-arched palate, long philtrum). Platyspondyly (esp. of cervical spine) and abnormal epiphyses and metaphyses are observed on radiography. Atlantoaxial instability causing spinal compression and recurrent respiratory disease are potential complications that may result lethal.	A rare, genetic primary bone dysplasia disorder characterized by disproportionate short stature with shortening of upper and lower limbs, short and broad fingers with short hands, narrowed chest with rib abnormalities and pectus excavatum, abnormal chondral calcifications (incl. larynx, trachea and costal cartilages) and facial dysmorphism (frontal bossing, hypertelorism, prominent eyes, short flat nose, wide nostrils, high-arched palate, long philtrum). Platyspondyly (esp. of cervical spine) and abnormal epiphyses and metaphyses are observed on radiography. Atlantoaxial instability causing spinal compression and recurrent respiratory disease are potential complications that may result lethal.
MONDO:0010078	definition	An autosomal dominant condition caused by mutation(s) in the COL2A1 gene, encoding collagen alpha-1(II) chain. It is characterized by short stature, pugilistic facies, midface hypoplasia, spondyloepiphyseal dysplasia, kyphosis, short ulna, and absent styloid process. Mutation(s) in the same gene are responsible for Kniest dysplasia.	A condition caused by by truncating mutations in the C-propeptide of COL2A1. Like other type II collagen disorders it is characterised by short stature, platyspondyly and epiphyseal dysplasia. A distinguishing feature is the presence of brachydactyly with a prominent first toe.
MONDO:0017686	definition	An acquired metabolic disease that is has its basis in the disruption of aminoacylase activity.	An inherited metabolic disease that is has its basis in the disruption of aminoacylase activity.
MONDO:0010613	definition	An acquired metabolic disease that is has its basis in the disruption of glycerol kinase activity.	An inherited metabolic disease that is has its basis in the disruption of glycerol kinase activity.
