mondo_id	property	value_old	value_new
MONDO:0010480	definition	An X-linked genetic condition caused by alterations in the gene G6PD that result in severely decreased activity levels of the enzyme glucose-6-phosphate dehydrogenase. Individuals with hemizygous G6PD variants associated with CNSHA have CNSHA. Individuals with G6PD variants that cause CNSHA are at risk for acute hemolytic anemia in response to certain medication exposures, chemical exposures, infections, or consumption of fava beans.	Any nonspherocytic hemolytic anemia in which the cause of the disease is a variation in the G6PD gene resulting in severely decreased activity levels of the enzyme glucose-6-phosphate dehydrogenase. Individuals with hemizygous G6PD variants associated with chronic nonspherocytic hemolytic anemia (CNSHA) have CNSHA. Individuals with G6PD variants that cause CNSHA are at risk for acute hemolytic anemia in response to certain medication exposures, chemical exposures, infections, or consumption of fava beans.
MONDO:0010496	definition	X-linked intellectual disability-short stature-overweight syndrome is a multiple congenital anomalies syndrome characterized by borderline to severe intellectual disability, speech delay, short stature, elevated body mass index, a pattern of truncal obesity (reported in older males), and variable neurologic features (e.g. hypotonia, tremors, gait disturbances, behavioral problems, and seizure disorders). Less common manifestations include microcephaly, microorchidism and/or microphallus. Dysmorphic features have been reported in some patients but no consitent pattern has been noted.	X-linked intellectual disability-short stature-overweight syndrome is a multiple congenital anomalies syndrome characterized by borderline to severe intellectual disability, speech delay, short stature, elevated body mass index, a pattern of truncal obesity (reported in older males), and variable neurologic features (e.g. hypotonia, tremors, gait disturbances, behavioral problems, and seizure disorders). Less common manifestations include microcephaly, microorchidism and/or microphallus. Dysmorphic features have been reported in some patients but no consistent pattern has been noted.
MONDO:0010786	definition	Chronic diarrhea with villous atrophy is a rare, genetic gastroenterological disease characterized by the early onset of chronic diarrhea, vomiting, anorexia, lactic acidosis, renal insuficiency and hepatic involvement (mild elevation of liver enzymes, steatosis, hepatomegaly). Partial villous atrophy (with eosinophilic infiltration) is observed on intestinal biopsy. Although diarrhea may resolve, the development of neurologic symptoms (cerebellar ataxia, sensorineural deafness, seizures), retinitis pigmentosa and muscle weakness may complicate disease course and lead to death. There have been no further descriptions in the literature since 1994.	Chronic diarrhea with villous atrophy is a rare, genetic gastroenterological disease characterized by the early onset of chronic diarrhea, vomiting, anorexia, lactic acidosis, renal insufficiency and hepatic involvement (mild elevation of liver enzymes, steatosis, hepatomegaly). Partial villous atrophy (with eosinophilic infiltration) is observed on intestinal biopsy. Although diarrhea may resolve, the development of neurologic symptoms (cerebellar ataxia, sensorineural deafness, seizures), retinitis pigmentosa and muscle weakness may complicate disease course and lead to death. There have been no further descriptions in the literature since 1994.
MONDO:0010826	definition	Childhood absence epilepsy (CAE) is a familial generalized pediatric epilepsy, characterized by very frequent (multiple per day) absence seizures, usually occurring in children between the ages of 4 and 10 years, with, in most cases, a good prognosis.	A familial generalized pediatric epilepsy, characterized by very frequent (multiple per day) absence seizures, usually occurring in children between the ages of 4 and 10 years, with, in most cases, a good prognosis.
MONDO:0010839	definition	Autosomal dominant congenital benign spinal muscular atrophy is a rare distal hereditary motor neuropathy, with a variable clinical phenotype, typically characterized by congenital, non-progressive, predominantly distal, lower limb muscle weakness and atrophy and congenital (or early-onset) flexion contractures of the hip, knee and ankle joints. Reduced or absent lower limb deep tendon reflexes, skeletal anomalies (bilateral talipes equinovarus, scoliosis, kyphoscoliosis, lumbar hyperlordisis), late ambulation, waddling gait, joint hyperlaxity and/or bladder and bowel dysfuntion are usually also associated.	Autosomal dominant congenital benign spinal muscular atrophy is a rare distal hereditary motor neuropathy, with a variable clinical phenotype, typically characterized by congenital, non-progressive, predominantly distal, lower limb muscle weakness and atrophy and congenital (or early-onset) flexion contractures of the hip, knee and ankle joints. Reduced or absent lower limb deep tendon reflexes, skeletal anomalies (bilateral talipes equinovarus, scoliosis, kyphoscoliosis, lumbar hyperlordisis), late ambulation, waddling gait, joint hyperlaxity and/or bladder and bowel dysfunction are usually also associated.
MONDO:0018543	definition	Autosomal dominant hypocalcemia (AD hypocalcemia) is a disorder of calcium homeostasis characterized by variable degrees of hypocalcemia with abnormally low levels of parathyroid hormone (PTH) and persistant normal or elevated calciuria.	Autosomal dominant hypocalcemia (AD hypocalcemia) is a disorder of calcium homeostasis characterized by variable degrees of hypocalcemia with abnormally low levels of parathyroid hormone (PTH) and persistent normal or elevated calciuria.
MONDO:0011200	definition	A focal dystonia characterized by predomiantly cervical dystonia that has material basis in variation in the chromosome region 18p.	A focal dystonia characterized by predominately cervical dystonia that has material basis in variation in the chromosome region 18p.
MONDO:0700268	definition	Hereditary cancer predisposition due to variation(s) in the BRAC1 gene. Germline pathogenic or likely pathogenic variants in the BRCA1 gene confer an autosomal dominant predisposition to hereditary breast and ovarian cancer. Tumor formation at other sites, including pancreatic cancer have been described.	Hereditary cancer predisposition due to variation(s) in the BRCA1 gene. Germline pathogenic or likely pathogenic variants in the BRCA1 gene confer an autosomal dominant predisposition to hereditary breast and ovarian cancer. Tumor formation at other sites, including pancreatic cancer have been described.
MONDO:0012747	definition	Glycogen storage disease due to aldolase A deficiency is an extremely rare glycogen storage disease characterized by hemolytic anemia with or without myopathy or intellectual deficit. Myopathy can be severe enough to result in fatal rhabdomyolysis in some patients. A family with episodic rhabdomyolysis (triggerd by fever) without hemolytic anemia has recently been reported.	Glycogen storage disease due to aldolase A deficiency is an extremely rare glycogen storage disease characterized by hemolytic anemia with or without myopathy or intellectual deficit. Myopathy can be severe enough to result in fatal rhabdomyolysis in some patients. A family with episodic rhabdomyolysis (triggered by fever) without hemolytic anemia has recently been reported.
MONDO:0013316	definition	Occult macular dystrophy is a rare, genetic retinal dystrophy disease characterized by bilateral progressive decline of visual acuity, due to retinal dysfunction confined only to the macula, associated with normal fundus and fluorescein angiograms and severly attenuated focal macular and multifocal electroretinograms.	Occult macular dystrophy is a rare, genetic retinal dystrophy disease characterized by bilateral progressive decline of visual acuity, due to retinal dysfunction confined only to the macula, associated with normal fundus and fluorescein angiograms and severely attenuated focal macular and multifocal electroretinograms.
MONDO:0013576	definition	Deficiencies in immunoglobulin (Ig) isotypes (including: isolated IgG subclass deficiency, IgG sublcass deficiency with IgA deficiency and kappa chain deficiency) are primary immunodeficiencies that are often asymptomatic but can be characterized by recurrent, often pyogenic, sinopulmonary infections.	Deficiencies in immunoglobulin (Ig) isotypes (including: isolated IgG subclass deficiency, IgG subclass deficiency with IgA deficiency and kappa chain deficiency) are primary immunodeficiencies that are often asymptomatic but can be characterized by recurrent, often pyogenic, sinopulmonary infections.
MONDO:0014382	definition	A rare multiple congenital anomalies syndrome characterized by greater hight, mild to moderate intellectual disability and distinctive facial appereance like round face, heavy, horizontal eyebrows and narrow palpebral fissures.	A rare multiple congenital anomalies syndrome characterized by greater height, mild to moderate intellectual disability and distinctive facial appearance like round face, heavy, horizontal eyebrows and narrow palpebral fissures.
MONDO:0014606	definition	Intellectual disability-microcephaly-strabismus-behavioral abnormalities syndrome is a rare, genetic, syndromic intellecutal disability disorder characterized by craniofacial dysmorphism (microcephaly, hypotonic facies, strabismus, long and flat malar region, posteriorly rotated ears, flat nasal bridge with broad nasal tip, short philtrum, thin vermillion border, open mouth with down-turned corners, high arched palate, pointed chin), global developmental delay, intellectual disability and variable neurobehavioral abnormalities (autism spectrum disorder, aggressivness, self injury). Additional features include vision abnormalities and variable sensorineural hearing loss, as well as short stature, hypotonia and gastrointestinal manifestations (e.g. poor feeding, gastroesophageal reflux, constipation).	Intellectual disability-microcephaly-strabismus-behavioral abnormalities syndrome is a rare, genetic, syndromic intellectual disability disorder characterized by craniofacial dysmorphism (microcephaly, hypotonic facies, strabismus, long and flat malar region, posteriorly rotated ears, flat nasal bridge with broad nasal tip, short philtrum, thin vermillion border, open mouth with down-turned corners, high arched palate, pointed chin), global developmental delay, intellectual disability and variable neurobehavioral abnormalities (autism spectrum disorder, aggressivness, self injury). Additional features include vision abnormalities and variable sensorineural hearing loss, as well as short stature, hypotonia and gastrointestinal manifestations (e.g. poor feeding, gastroesophageal reflux, constipation).
MONDO:0015034	definition	Lissencephaly with cerebellar hypoplasia type A (LCHa) is a form of lissencephaly with cerebellar hypoplasia that encompasses classical lissencephaly with thickened cortical gray matter with either no discernable gradient, a gradient with posterior predominance, or a gradient with anterior predominance, and cerebellar vermis hypoplasia.	Lissencephaly with cerebellar hypoplasia type A (LCHa) is a form of lissencephaly with cerebellar hypoplasia that encompasses classical lissencephaly with thickened cortical gray matter with either no discernible gradient, a gradient with posterior predominance, or a gradient with anterior predominance, and cerebellar vermis hypoplasia.
MONDO:0015236	definition	Congenital abnormalities of the aortic arch result from aberrant development of one or more components of the embyronic pharangeal arch system. Any component of tihs system can regress or persist abnormally, resulting in an extensive array of aortic arch anomalies. Clinically, they are classified by those that cause (or are likely to cause) physiolgogical abnormalities and those that do not. Physiologic abnormalities include tracheobronchial compression, esophageeal compression, and abnormal blood flow patteren.	Congenital abnormalities of the aortic arch result from aberrant development of one or more components of the embyronic pharangeal arch system. Any component of this system can regress or persist abnormally, resulting in an extensive array of aortic arch anomalies. Clinically, they are classified by those that cause (or are likely to cause) physiolgogical abnormalities and those that do not. Physiologic abnormalities include tracheobronchial compression, esophageeal compression, and abnormal blood flow patteren.
MONDO:0015248	definition	A rare, genetic, multiple congenital anomalies/dysmorphic syndrome characterized by cerebellar-like ataxia, photosensitivity (mainly of the face and trunk), short stature and intellectual disability. Additonal features include clinodactyly, single palmar transverse crease, high-arched palate, pseudohypertrophy of the calves and aortic valve lesions. There have been no further descriptions in the literature since 1983.	A rare, genetic, multiple congenital anomalies/dysmorphic syndrome characterized by cerebellar-like ataxia, photosensitivity (mainly of the face and trunk), short stature and intellectual disability. Additional features include clinodactyly, single palmar transverse crease, high-arched palate, pseudohypertrophy of the calves and aortic valve lesions. There have been no further descriptions in the literature since 1983.
MONDO:0015585	definition	Cryptogenic late-onset epileptic spasms is a rare epilepsy syndrome characterized by late-onset (after 1 year old) epileptic spasms that ocurr in clusters, associated with tonic seizures, atypical absences and cognitive deterioration. Language difficulties and behavior problems are frequently present. EEG is characterized by a temporal, or temporofrontal, slow wave or spike focus combined with synchronous spike-waves and no hypsarrhythmia or background activity.	Cryptogenic late-onset epileptic spasms is a rare epilepsy syndrome characterized by late-onset (after 1 year old) epileptic spasms that occur in clusters, associated with tonic seizures, atypical absences and cognitive deterioration. Language difficulties and behavior problems are frequently present. EEG is characterized by a temporal, or temporofrontal, slow wave or spike focus combined with synchronous spike-waves and no hypsarrhythmia or background activity.
MONDO:0018354	definition	Prader-Willi-like syndrome is a rare, genetic, endocrine disease characterized by manifestations of a Prader-Willi syndrome phenotype (including obesity, hyperphagia, hypotonia, psychomotor delay, intellectual disability, small hands/feet, hypogonadism, growth hormone deficiency and characteristic facial features) ocurring in the absence of 15q11-q13 genomic abnormalities.	Prader-Willi-like syndrome is a rare, genetic, endocrine disease characterized by manifestations of a Prader-Willi syndrome phenotype (including obesity, hyperphagia, hypotonia, psychomotor delay, intellectual disability, small hands/feet, hypogonadism, growth hormone deficiency and characteristic facial features) occurring in the absence of 15q11-q13 genomic abnormalities.
MONDO:0016943	definition	Chromosome 6p duplication is a chromosome abnormality that occurs when there is an extra copy of genetic material on the short arm (p) of chromosome 6. The severity of the condition and the signs and symptoms depend on the size and location of the duplication and which genes are involved. Features that often occur in people with chromosome 6p duplication include developmental delay, intellectual disability, behavioral problems and distinctive facial features. This condition can occur sporadically or be inherited from aparent who is either mildy affected (has the deletion) or carries a balanced translocation. Treatment is based on the signs and symptoms present in each person.	Chromosome 6p duplication is a chromosome abnormality that occurs when there is an extra copy of genetic material on the short arm (p) of chromosome 6. The severity of the condition and the signs and symptoms depend on the size and location of the duplication and which genes are involved. Features that often occur in people with chromosome 6p duplication include developmental delay, intellectual disability, behavioral problems and distinctive facial features. This condition can occur sporadically or be inherited from a parent who is either mildy affected (has the deletion) or carries a balanced translocation. Treatment is based on the signs and symptoms present in each person.
MONDO:0016071	definition	Juvenile hyaline fibromatosis (JHF) is a rare soft tissue tumor, characterized by papulo-nodular skin lesions (especially around the head and neck), soft tissue masses, gingival hypertrophy, joint contractures, and osteolytic bone lesions in variable degrees. Joint contractures may cripple patients and delay normal motor development if occuring in infancy. Severe gingival hyperplasia can interfere with eating and delay dentition. Histopathology analysis of involved tissues reveals cords of spindle-shaped cells embedded in an amorphous, hyaline material. JHF is a mild form of infantile systemic hyalinosis.	Juvenile hyaline fibromatosis (JHF) is a rare soft tissue tumor, characterized by papulo-nodular skin lesions (especially around the head and neck), soft tissue masses, gingival hypertrophy, joint contractures, and osteolytic bone lesions in variable degrees. Joint contractures may cripple patients and delay normal motor development if occurring in infancy. Severe gingival hyperplasia can interfere with eating and delay dentition. Histopathology analysis of involved tissues reveals cords of spindle-shaped cells embedded in an amorphous, hyaline material. JHF is a mild form of infantile systemic hyalinosis.
MONDO:0016284	definition	Primitive neuroectodermal tumor of the cervix uteri is a rare cancer of cervix uteri derived from neural crest cells, histologically composed of small, round neoplatic cells with variable degree of neural, glial and ependymal differentiation. Macroscopically, the tumor is often a large, soft, poorly circumscribed mass with infiltrative borders and necrotic areas. It presents with dysfuntional vaginal bleeding or discharge, lower abdominal pain and uterine enlargement.	Primitive neuroectodermal tumor of the cervix uteri is a rare cancer of cervix uteri derived from neural crest cells, histologically composed of small, round neoplatic cells with variable degree of neural, glial and ependymal differentiation. Macroscopically, the tumor is often a large, soft, poorly circumscribed mass with infiltrative borders and necrotic areas. It presents with dysfunctional vaginal bleeding or discharge, lower abdominal pain and uterine enlargement.
MONDO:0016521	definition	Muscular pseudohypertropy - hypothyroidism, also known as Kocher-Debre-Semelaigne syndrome is a rare disorder characterized by pseudohypertrophy of muscles due to longstanding hypothyroidism.	Muscular pseudohypertrophy - hypothyroidism, also known as Kocher-Debre-Semelaigne syndrome is a rare disorder characterized by pseudohypertrophy of muscles due to longstanding hypothyroidism.
MONDO:0016554	definition	A rare endocrine disease characterized by the appearance of transient hypothyroidism, usually in preterm newborns, following long or short-term topical iodine exposure. Parenteral exposure from iodinated contrast agents may similarly alter thyroid funtion in term neonates.	A rare endocrine disease characterized by the appearance of transient hypothyroidism, usually in preterm newborns, following long or short-term topical iodine exposure. Parenteral exposure from iodinated contrast agents may similarly alter thyroid function in term neonates.
MONDO:0016653	definition	2q33.1 microdeletion syndrome is a rare chromosomal anomaly syndrome, resulting from the partial deletion of the long arm of chromosome 2, with a highly variable phenotype typically characterized by severe intellectual disability, moderate to severe developmental delay (particularly speech), feeding difficulties, failure to thrive, hypotonia, thin, sparse hair, various dental abnormalities and cleft/high-arched palate. Typical dysmorphic features inlcude high, prominent forehead, down-slanting palpebral fissures and prominent nasal bridge with beaked nose. Various behavioral problems (e.g. hyperactivity, chaotic/repetitive behavior, touch avoidance) are also associated.	2q33.1 microdeletion syndrome is a rare chromosomal anomaly syndrome, resulting from the partial deletion of the long arm of chromosome 2, with a highly variable phenotype typically characterized by severe intellectual disability, moderate to severe developmental delay (particularly speech), feeding difficulties, failure to thrive, hypotonia, thin, sparse hair, various dental abnormalities and cleft/high-arched palate. Typical dysmorphic features include high, prominent forehead, down-slanting palpebral fissures and prominent nasal bridge with beaked nose. Various behavioral problems (e.g. hyperactivity, chaotic/repetitive behavior, touch avoidance) are also associated.
MONDO:0016668	definition	Sickle beta thalassemia is an inherited condition that affects hemoglobin, the protein in red blood cells that carries oxygen to different parts of the body.It is a type of sickle cell disease. Affected people havea differentchange (mutation) in each copy of their HBB gene: onethat causes red blood cells to form a 'sickle' or crescent shape and a second that is associated with beta thalassemia, a blood disorder that reduces the production of hemoglobin. Depending on the beta thalassemia mutation, people may have no normal hemoglobin (called sickle beta zero thalassemia) or a reduced amount of normal hemoglobin (called sickle beta plus thalassemia). The presence of sickle-shaped red blood cells, which often breakdown prematurely and can get stuck in blood vessels, combined with the reduction or absence of mature redblood cells leadsto the many signs and symptoms of sickle beta thalassemia. Features, which may include anemia (low levels of red blood cells), repeated infections, and frequent episodes of pain, generally develop in early childhood and vary in severity depending on the amount of normal hemoglobin made. Sickle beta thalassemia is inherited in an autosomal recessive manner. Treatment is supportive and depends on the signs and symptoms present in each person.	Sickle beta thalassemia is an inherited condition that affects hemoglobin, the protein in red blood cells that carries oxygen to different parts of the body.It is a type of sickle cell disease. Affected people have a differentchange (mutation) in each copy of their HBB gene: onethat causes red blood cells to form a 'sickle' or crescent shape and a second that is associated with beta thalassemia, a blood disorder that reduces the production of hemoglobin. Depending on the beta thalassemia mutation, people may have no normal hemoglobin (called sickle beta zero thalassemia) or a reduced amount of normal hemoglobin (called sickle beta plus thalassemia). The presence of sickle-shaped red blood cells, which often breakdown prematurely and can get stuck in blood vessels, combined with the reduction or absence of mature redblood cells leads to the many signs and symptoms of sickle beta thalassemia. Features, which may include anemia (low levels of red blood cells), repeated infections, and frequent episodes of pain, generally develop in early childhood and vary in severity depending on the amount of normal hemoglobin made. Sickle beta thalassemia is inherited in an autosomal recessive manner. Treatment is supportive and depends on the signs and symptoms present in each person.
MONDO:0017232	definition	Recessive intellectual disability-motor dysfunction-multiple joint contractures syndrome is a rare, genetic, syndromic intellectual disabilty disorder characterized by severe intellectual disability, progressive, postnatal, multiple joint contractures and severe motor dysfunction. Patients present arrest and regression of motor function and speech acquisition, as well as contractures which begin in lower limbs and slowly progress in an ascending manner to include spine and neck, resulting in individuals presenting a specific fixed position.	Recessive intellectual disability-motor dysfunction-multiple joint contractures syndrome is a rare, genetic, syndromic intellectual disability disorder characterized by severe intellectual disability, progressive, postnatal, multiple joint contractures and severe motor dysfunction. Patients present arrest and regression of motor function and speech acquisition, as well as contractures which begin in lower limbs and slowly progress in an ascending manner to include spine and neck, resulting in individuals presenting a specific fixed position.
