mondo_id	property	value_old	value_new
MONDO:0001726	label	childhood disintegrative disease	obsolete childhood disintegrative disease
MONDO:0003804	label	blood protein disease	obsolete blood protein disease
MONDO:0004955	label	metabolic syndrome	obsolete metabolic syndrome
MONDO:0006089	label	appendix goblet cell carcinoid	obsolete appendix goblet cell carcinoid
MONDO:0006832	label	limited scleroderma	obsolete limited scleroderma
MONDO:0006906	label	pigmented villonodular synovitis	obsolete pigmented villonodular synovitis
MONDO:0018230	label	primary bone dysplasia	skeletal dysplasia
MONDO:0007818	label	Hyper-IgE recurrent infection syndrome 1	hyper-IgE recurrent infection syndrome 1
MONDO:0007944	label	Treacher-Collins syndrome 1	Treacher Collins syndrome 1
MONDO:0008675	label	freeman-Sheldon syndrome	Freeman-Sheldon syndrome
MONDO:0009100	label	IDDM 1	type 1 diabetes mellitus 1
MONDO:0009613	label	vitamin B12-responsive methylmalonic acidemia type cblA	methylmalonic aciduria, cblA type
MONDO:0009614	label	vitamin B12-responsive methylmalonic acidemia type cblB	methylmalonic aciduria, cblB type
MONDO:0010143	label	lethal restrictive dermopathy	obsolete lethal restrictive dermopathy
MONDO:0010594	label	inherited genitourinary tract anomalies	obsolete inherited genitourinary tract anomalies
MONDO:0015880	label	syndromic diaphragmatic or thoracic malformation	obsolete syndromic diaphragmatic or thoracic malformation
MONDO:0011108	label	Stüve-Wiedemann syndrome	obsolete Stüve-Wiedemann syndrome
MONDO:0011878	label	Worth syndrome	obsolete Worth syndrome
MONDO:0043678	label	chromosome inversion	chromosome inversion disorder
MONDO:0014109	label	NGLY1-deficiency	obsolete NGLY1-deficiency
MONDO:0014129	label	autosomal recessive limb-girdle muscular dystrophy type 2R	obsolete autosomal recessive limb-girdle muscular dystrophy type 2R
MONDO:0014761	label	hereditary pediatric Behçet-like disease	obsolete hereditary pediatric Behçet-like disease
MONDO:0014977	label	autosomal recessive limb-girdle muscular dystrophy type 2Z	autosomal recessive limb-girdle muscular dystrophy type 2R1
MONDO:0015879	label	non-syndromic diaphragmatic or thoracic malformation	obsolete non-syndromic diaphragmatic or thoracic malformation
MONDO:0017606	label	facial nerve palsy due to herpes zoster infection	obsolete facial nerve palsy due to herpes zoster infection
MONDO:0018138	label	ocular albinism with congenital sensorineural hearing loss	obsolete ocular albinism with congenital sensorineural hearing loss
MONDO:0019664	label	short rib-polydactyly syndrome, Verma-Naumoff type	obsolete short rib-polydactyly syndrome, Verma-Naumoff type
MONDO:0020051	label	total autosomal trisomy	obsolete total autosomal trisomy
MONDO:0020052	label	partial autosomal trisomy/tetrasomy	obsolete partial autosomal trisomy/tetrasomy
MONDO:0020591	label	disorder of peritoneum	obsolete disorder of peritoneum
MONDO:0020595	label	disorder of retroperitoneum	obsolete disorder of retroperitoneum
MONDO:0020718	label	congenital short bowel syndrome 1	congenital short bowel syndrome, autosomal recessive
MONDO:0021016	label	channelopathy	obsolete channelopathy
MONDO:0021145	label	disorder of genitourinary system	obsolete disorder of genitourinary system
MONDO:0023235	label	giant congenital nevus	obsolete giant congenital nevus
MONDO:0025370	label	urogenital neoplasm	obsolete urogenital neoplasm
MONDO:0030067	label	treacher collins syndrome 4	Treacher Collins syndrome 4
MONDO:0043707	label	mediastinal disorder	obsolete mediastinal disorder
MONDO:0044640	label	charcot-marie-tooth disease type 2T	Charcot-Marie-Tooth disease type 2T
MONDO:0044989	label	foot disorder	obsolete foot disorder
MONDO:0044990	label	hand disorder	obsolete hand disorder
MONDO:0060712	label	developmental delay, intellectual disability, obesity, and dysmorphic features	obsolete developmental delay, intellectual disability, obesity, and dysmorphic features
MONDO:0009943	definition	Pyle disease is a bone dysplasia characterised by genu valgum, metaphyseal anomalies with broadening of the long bones extending into the diaphyses and giving the femora and tibiae an 'Erlenmeyer flask'' appearance, widening of the ribs and clavicles, platyspondyly and cortical thinning.	A bone dysplasia characterised by genu valgum, metaphyseal anomalies with broadening of the long bones extending into the diaphyses and giving the femora and tibiae an 'Erlenmeyer flask'' appearance, widening of the ribs and clavicles, platyspondyly and cortical thinning.
MONDO:0018234	definition	A disorder of the development of bone in which ossification is affected.	A group of disorders in which the skeletal involvement is predominantly manifested as abnormalities of individual bones or in a group of bones.
MONDO:0000188	definition		An epileptic encephalopathy resulting from impaired glucose transport into the brain.
MONDO:0002279	definition	Disorders in the processing of iron in the body: its absorption, transport, storage, and utilization. (From Mosby's Medical, Nursing, & Allied Health Dictionary, 4th ed)	Disorders in the processing of iron in the body: its absorption, transport, storage, and utilization.
MONDO:0001726	definition	A pediatric disorder characterized by normal development for at least the first two years of life followed by a severe regression in language, social interaction, bowel or bladder control, and/or motor skills. The affected individual may also exhibit repetitive and stereotyped patterns of behavior similar to autism.	
MONDO:0001793	definition	Diseases of the lacrimal apparatus.	Profuse lacrimation.
MONDO:0004955	definition	A combination of medical conditions that, when present, increase the risk of heart attack, stroke, and diabetes mellitus. It includes the following medical conditions: increased blood pressure, central obesity, abnormal cholesterol levels, and elevated fasting glucose.	
MONDO:0004978	definition	In the same amount or manner; to the same degree; in the role, function, or capacity of.	
MONDO:0006089	definition	An invasive mixed adenoneuroendocrine carcinoma of the appendix characterized by a submucosal growth and the presence of neoplastic signet-ring cells resembling goblet cells of the intestine.	
MONDO:0006832	definition	The least progressive form of systemic scleroderma with skin thickening restricted to the face, neck and areas distal to the elbows and/or knees, sparing the trunk. The crest syndrome is a form of limited scleroderma.	
MONDO:0006906	definition	Pigmented villonodular synovitis (PVNS) is a rare benign proliferative disorder of the synovial membrane primarily affecting young adults (with a peak age of onset in the second to fourth decade of life) characterized by proliferative, locally invasive tumor-like lesions, usually involving a single joint, tendon sheath or bursae (most commonly the joints of the knee and hip and rarely others such as the ankle, shoulder and temporomandibular joints). It presents with pain and limitation of motion along with swelling, heat and tenderness over the involved joint, eventually leading to arthritic degeneration and significant locomotor deficit, if left untreated. PVNS can recur in patients even after treatment.	
MONDO:0016085	definition	Cole-Carpenter syndrome is an extremely rare form of bone dysplasia characterized by the features of osteogenesis imperfecta such as bone fragility associated with multiple fractures, bone deformities (metaphyseal irregularities and bowing of the long bones) and blue sclera, in association with growth failure, craniosynostosis, hydrocephalus, ocular proptosis, and distinctive facial features (e.g. frontal bossing, midface hypoplasia, and micrognathia).	An extremely rare form of bone dysplasia characterized by the features of osteogenesis imperfecta such as bone fragility associated with multiple fractures, bone deformities (metaphyseal irregularities and bowing of the long bones) and blue sclera, in association with growth failure, craniosynostosis, hydrocephalus, ocular proptosis, and distinctive facial features (e.g. frontal bossing, midface hypoplasia, and micrognathia).
MONDO:0007252	definition	Gordon syndrome, also known as distal arthrogryposis type 3, is an extremely rare multiple congenital malformation syndrome characterized by congenital contractures of hand and feet with variable degrees of severity of camptodactyly, clubfoot and, less frequently, cleft palate. Intelligence is normal but in some cases, additional abnormalities, such as short stature, kyphoscoliosis, ptosis, micrognathia, and cryptorchidism may also be present. Gordon syndrome, Marden-Walker syndrome and arthrogryposis with oculomotor limitation and electroretinal anomalies clinically and genetically overlap, and could represent variable expressions of the same condition.	An extremely rare multiple congenital malformation syndrome characterized by congenital contractures of hand and feet with variable degrees of severity of camptodactyly, clubfoot and, less frequently, cleft palate. Intelligence is normal but in some cases, additional abnormalities, such as short stature, kyphoscoliosis, ptosis, micrognathia, and cryptorchidism may also be present. Gordon syndrome, Marden-Walker syndrome and arthrogryposis with oculomotor limitation and electroretinal anomalies clinically and genetically overlap, and could represent variable expressions of the same condition.
MONDO:0018230	definition		Any Mendelian diseases that affects growth and development of the skeleton.
MONDO:0007764	definition	Worth type autosomal dominant osteosclerosis is a sclerozing bone disorder characterized by generalized skeletal densification, particularly of the cranial vault and tubular long bones, which is not associated to an increased risk of fracture.	A sclerozing bone disorder characterized by generalized skeletal densification, particularly of the cranial vault and tubular long bones, which is not associated to an increased risk of fracture.
MONDO:0019162	definition	Pseudohypoaldosteronism type 2 (PHA2) is a rare inherited form of hypertension characterized by hyperkalemia, hyperchloremic metabolic acidosis, normal or elevated aldosterone, low renin, and normal renal function.	A rare inherited form of hypertension characterized by hyperkalemia, hyperchloremic metabolic acidosis, normal or elevated aldosterone, low renin, and normal renal function.
MONDO:0007827	definition	Inclusion body myositis (IBM) is a slowly progressive degenerative inflammatory disorder of skeletal muscles characterized by late onset weakness of specific muscles and distinctive histopathological features.	A slowly progressive degenerative inflammatory disorder of skeletal muscles characterized by late onset weakness of specific muscles and distinctive histopathological features.
MONDO:0007864	definition	Angio-osteohypertrophic (AOH) syndrome is a congenital vascular bone syndrome (CVBS) characterized by the presence of a vascular malformation in a limb, mainly of the arteriovenous type, which results in overgrowth of the affected limb.	A congenital vascular bone syndrome (CVBS) characterized by the presence of a vascular malformation in a limb, mainly of the arteriovenous type, which results in overgrowth of the affected limb.
MONDO:0016797	definition		A mitochondrial oxidative phosphorylation disorder in which mitochondrial DNA (mtDNA) level is lower than normal.
MONDO:0018975	definition	Neurofibromatosis type 1 (NF1) is a clinically heterogeneous, neurocutaneous genetic disorder characterized by cafe-au-lait spots, iris Lisch nodules, axillary and inguinal freckling, and multiple neurofibromas.	A clinically heterogeneous, neurocutaneous genetic disorder characterized by cafe-au-lait spots, iris Lisch nodules, axillary and inguinal freckling, and multiple neurofibromas.
MONDO:0008270	definition	Polydactyly of a triphalangeal thumb or PPD2 is a form of preaxial polydactyly of fingers, a limb malformation syndrome, that is characterized by the presence of a usually opposable triphalangeal thumb with or without additional duplication of one or more skeletal components of the thumb. The thumb appearance can differ widely in shape (wedge to rectangular) or it can be deviated in the radio-ulnar plane (clinodactyly). PPD2 is also associated with systemic syndromes, including Holt-Oram syndrome and Fanconi anemia.	A form of preaxial polydactyly of fingers, a limb malformation syndrome, that is characterized by the presence of a usually opposable triphalangeal thumb with or without additional duplication of one or more skeletal components of the thumb. The thumb appearance can differ widely in shape (wedge to rectangular) or it can be deviated in the radio-ulnar plane (clinodactyly). PPD2 is also associated with systemic syndromes, including Holt-Oram syndrome and Fanconi anemia.
MONDO:0008515	definition	Syndactyly type 4 (SD4) is a very rare congenital distal limb malformation characterized by complete bilateral syndactyly (involving all digits 1 to 5).	A very rare congenital distal limb malformation characterized by complete bilateral syndactyly (involving all digits 1 to 5).
MONDO:0009100	definition		Any type 1 diabetes mellitus that is caused by variation in genes located in the MHC complex on chromosome 6p21.3.
MONDO:0010143	definition	Restrictive dermopathy (RD) is a neonatal lethal genetic disease characterized by very tight and thin skin with erosions and scaling, associated to a typical facial dysmorphism, arthrogryposis multiplex, fetal akinesia or hypokinesia deformation sequence (FADS) and pulmonary hypoplasia without neurological abnormalities.	
MONDO:0010275	definition	Spondyloepimetaphyseal dysplasia, Bieganski type is a rare primary bone dysplasia disorder characterized by infantile-onset, progressive, multiple skeletal deformities in association with slowly progressive central and peripheral neurodegeneration. Patients present short stature, coarse facies, psychomotor regression and cognitive impairment. Imaging shows abnormally-shaped vertebral bodies, small, flat epiphyses, and widened metaphyses, as well as cerebral and cerebellar atrophy and progressive axonal-hypomyelinating neuropathy.	A rare genetic neurological disorder characterized by the association of hypomyelinating leukodystrophy with spondylometaphyseal dysplasia. Patients present in infancy with absent or delayed ability to walk independently, slowly progressive motor deterioration, spasticity, ataxia, proximal weakness, and joint contractures. Additional manifestations include mild cognitive impairment, short stature, scoliosis, enlarged and deformed joints, dysarthria, nystagmus, visual defects, and mildly dysmorphic features, among others. Mode of inheritance is X-linked recessive.
MONDO:0019027	definition	Otopalatodigital (OPD) syndrome is a form of frontootopalatodigital syndrome, characterized by deafness, cleft palate, and characteristic digital anomalies. OPD syndrome is divided into two forms based on severity: the milder form designated OPD type 1 (OPD1), and the more severe and often lethal form designated OPD type 2 (OPD2). OPD is an X-linked disorder. Two other genetic disorders with features overlapping OPD, frontometaphyseal dysplasia (FMD) and osteodysplasty, Melnick-Needles type (MNS) have been described; thus OPD1, OPD2, FMD, and MNS are allelic disorders.	A form of frontootopalatodigital syndrome, characterized by deafness, cleft palate, and characteristic digital anomalies. OPD syndrome is divided into two forms based on severity: the milder form designated OPD type 1 (OPD1), and the more severe and often lethal form designated OPD type 2 (OPD2). OPD is an X-linked disorder. Two other genetic disorders with features overlapping OPD, frontometaphyseal dysplasia (FMD) and osteodysplasty, Melnick-Needles type (MNS) have been described; thus OPD1, OPD2, FMD, and MNS are allelic disorders.
MONDO:0010704	definition	Otopalatodigital syndrome type 1 (OPD1) is the mildest form of otopalatodigital syndrome spectrum disorder, and is characterized by a generalized skeletal dysplasia, mild intellectual disability, conductive hearing loss, and typical facial anomalies.	The mildest form of otopalatodigital syndrome spectrum disorder that is characterized by a generalized skeletal dysplasia, mild intellectual disability, conductive hearing loss, and typical facial anomalies.
MONDO:0019037	definition	Progressive supranuclear palsy (PSP) is a rare late-onset neurodegenerative disease characterized by supranuclear gaze palsy, postural instability, progressive rigidity, and mild dementia.	A rare late-onset neurodegenerative disease characterized by supranuclear gaze palsy, postural instability, progressive rigidity, and mild dementia.
MONDO:0011076	definition	Desminopathy is a rare genetic skeletal muscle disease characterized by abnormal chimeric aggregates of desmin and other cytoskeletal proteins and granulofilamentous material at the ultrastructural level in muscle biopsies and variable clinical/ myopathological features, age of disease onset and rate of disease progression. Patients present with bilateral skeletal muscle weakness that starts in distal leg muscles and spreads proximally, sometimes involving trunk, neck flexors and facial muscles and often cardiomyopathy manifested by conduction blocks, arrhythmias, chronic heart failure, and sometimes tachyarrhythmia. Weakness eventually leads to wheelchair dependence. Respiratory insufficiency can be a major cause of disability and death, beginning with nocturnal hyperventilation with oxygen desaturation and progressing to daytime respiratory failure.	A rare genetic skeletal muscle disease characterized by abnormal chimeric aggregates of desmin and other cytoskeletal proteins and granulofilamentous material at the ultrastructural level in muscle biopsies and variable clinical/ myopathological features, age of disease onset and rate of disease progression. Patients present with bilateral skeletal muscle weakness that starts in distal leg muscles and spreads proximally, sometimes involving trunk, neck flexors and facial muscles and often cardiomyopathy manifested by conduction blocks, arrhythmias, chronic heart failure, and sometimes tachyarrhythmia. Weakness eventually leads to wheelchair dependence. Respiratory insufficiency can be a major cause of disability and death, beginning with nocturnal hyperventilation with oxygen desaturation and progressing to daytime respiratory failure.
MONDO:0011108	definition	A rare autosomal recessive congenital primary skeletal dysplasia, characterized by small stature, bowing of the long bones, camptodactyly, hyperthermic episodes, respiratory distress/apneic episodes and feeding difficulties that usually lead to early mortality.	
MONDO:0011273	definition	H syndrome is a systemic inherited histiocytosis, with characteristic cutaneous findings accompanying systemic manifestations. H syndrome refers to the major clinical findings of hyperpigmentation, hypertrichosis, hepatosplenomegaly, heart anomalies, hearing loss, hypogonadism, low height, and occasionally, hyperglycemia/diabetes mellitus. Due to overlapping clinical features, H syndrome is now considered to include pigmented hypertrichosis with insulin dependent diabetes mellitus syndrome (PHID), Faisalabad histiocytosis (FHC) and familial sinus histiocytosis with massive lymphadenopathy (FSHML).	A systemic inherited histiocytosis, with characteristic cutaneous findings accompanying systemic manifestations. H syndrome refers to the major clinical findings of hyperpigmentation, hypertrichosis, hepatosplenomegaly, heart anomalies, hearing loss, hypogonadism, low height, and occasionally, hyperglycemia/diabetes mellitus. Due to overlapping clinical features, H syndrome is now considered to include pigmented hypertrichosis with insulin dependent diabetes mellitus syndrome (PHID), Faisalabad histiocytosis (FHC) and familial sinus histiocytosis with massive lymphadenopathy (FSHML).
MONDO:0011878	definition	A hyperostosis that has material basis in a mutation in the LRP5 gene which results in increased bone density and bony structures located in palate.	
MONDO:0011897	definition	Leukoencephalopathy-ataxia-hypodontia-hypomyelination syndrome is characterised by ataxia, delayed dentition, hypomyelination and cerebral atrophy. So far, eight cases have been described.	A syndrome is characterised by ataxia, delayed dentition, hypomyelination and cerebral atrophy. So far, eight cases have been described.
MONDO:0012004	definition	Parathyroid carcinoma (PRTC) is a very rare, slow-growing, clinically serious endocrine tumor that generally develops in mid-adulthood. PRTC presents as a palpable painless mass in the neck and causes severe hypercalcemia and related symptoms, non-specific gastrointestinal manifestations, as well as renal and bone complications related to primary hyperparathyroidism (nephrolithiasis, impaired renal function, osteoporosis, bone pain, and pathologic fractures, etc.). Some PRTCs are however non-functioning tumors.	A very rare, slow-growing, clinically serious endocrine tumor that generally develops in mid-adulthood. PRTC presents as a palpable painless mass in the neck and causes severe hypercalcemia and related symptoms, non-specific gastrointestinal manifestations, as well as renal and bone complications related to primary hyperparathyroidism (nephrolithiasis, impaired renal function, osteoporosis, bone pain, and pathologic fractures, etc.). Some PRTCs are however non-functioning tumors.
MONDO:0043678	definition	A type of chromosome rearrangement in which a segment has been turned through 180 degrees (inverted), and inserted back into its original location on the chromosome.	Chromosomal disorder consisting of the presence a chromosome rearrangement in which a segment has been turned through 180 degrees (inverted), and inserted back into its original location on the chromosome.
MONDO:0012805	definition	Paroxysmal exertion-induced dyskinesia (PED) is a form of paroxysmal dyskinesia, characterized by painless attacks of dystonia of the extremities triggered by prolonged physical activities.	A form of paroxysmal dyskinesia, characterized by painless attacks of dystonia of the extremities triggered by prolonged physical activities.
MONDO:0034024	definition	A rare systemic disease for which two subtypes exist, either related to the gene PLOD1 or FKBP22, and for which the clinically overlapping characteristics include congenital muscle hypotonia, congenital or early-onset kyphoscoliosis (progressive or non-progressive), and generalized joint hypermobility with dislocations/subluxations (in particular of the shoulders, hips, and knees). Additional features which may occur in both subtypes are skin hyperextensibility, easy bruising of the skin, rupture/aneurysm of a medium-sized artery, osteopenia/osteoporosis, blue sclerae, umbilical or inguinal hernia, chest deformity, marfanoid habitus, talipes equinovarus, and refractive errors. Gene-specific features, with variable presentation, are additionally observed in each subtype.	A rare systemic disease for which two subtypes exist, either related to the gene PLOD1 or FKBP14 (formerly FKBP22), and for which the clinically overlapping characteristics include congenital muscle hypotonia, congenital or early-onset kyphoscoliosis (progressive or non-progressive), and generalized joint hypermobility with dislocations/subluxations (in particular of the shoulders, hips, and knees). Additional features which may occur in both subtypes are skin hyperextensibility, easy bruising of the skin, rupture/aneurysm of a medium-sized artery, osteopenia/osteoporosis, blue sclerae, umbilical or inguinal hernia, chest deformity, marfanoid habitus, talipes equinovarus, and refractive errors. Gene-specific features, with variable presentation, are additionally observed in each subtype.
MONDO:0014109	definition	A rare autosomal recessive inherited disorder caused by mutations in the NGLY1 gene. It is characterized by developmental delay, hypotonia, abnormal involuntary movements, poor tear production, microcephaly, intractable seizures, abnormal eye movements, and liver abnormalities.	
MONDO:0014128	definition	Any craniosynostosis in which the cause of the disease is a mutation in the TCF12 gene.	Any syndromic craniosynostosis in which the cause of the disease is a mutation in the TCF12 gene.
MONDO:0014129	definition	Autosomal recessive limb-girdle muscular dystrophy type 2R (LGMD2R) is a form of limb-girdle muscular dystrophy characterized by the adolescent or early adulthood-onset of progressive proximal muscle weakness and mild facial muscle weakness, with patients becoming wheelchair bound in their fourth to fifth decade of life. Mild, bilateral winged scapula, incomplete right bundle branch block, and a sinus rhythm with very rare ventricular extrasystoles have also been reported.	
MONDO:0014382	definition		A rare multiple congenital anomalies syndrome characterized by greater hight, mild to moderate intellectual disability and distinctive facial appereance like round face, heavy, horizontal eyebrows and narrow palpebral fissures.
MONDO:0014558	definition		A rare genetic neurodevelopmental disorder characterized by global developmental delay (DD) and variable degrees of intellectual disability (ID) with delayed or limited/absent speech development associated with neonatal hypotonia, feeding difficulties, cardiac anomalies and dysmorphic facial features, predominantly broad nasal tip and thin, tented upper lip. Microcephaly, frequent infections, gastrointestinal and/or ocular anomalies have also been described.
