mondo_id	label	definition	obsolete	obsoletion_candidate
MONDO:1013793	aural adenocarcinoma, non-human animal			
MONDO:1013794	aural hematoma, non-human animal			
MONDO:1013795	auricular chondritis, non-human animal			
MONDO:1013796	complete deafness, non-human animal			
MONDO:1013797	partial deafness, non-human animal			
MONDO:1013798	chronic ear disease, non-human animal			
MONDO:1013799	bacterial ear infection, non-human animal			
MONDO:1013800	fungal ear infection, non-human animal			
MONDO:1013802	chronic otitis externa, non-human animal			
MONDO:1013803	otitis externa of meatus and canal, non-human animal			
MONDO:1013804	otitis externa of pinna, non-human animal			
MONDO:1013805	infective otitis externa, non-human animal			
MONDO:1013806	acute otitis media, non-human animal	Infectious otitis media that occurs in non-human animals.		
MONDO:1013807	chronic otitis media, non-human animal	Chronic otitis media that occurs in non-human animals.		
MONDO:1013808	infective otitis media, non-human animal			
MONDO:1013809	ear mass, non-human animal			
MONDO:1013810	traumatic ear canal avulsion, non-human animal			
MONDO:1013811	ear cutaneous squamous cell carcinoma, non-human animal			
MONDO:1013812	ear canal polyp, non-human animal			
MONDO:1013813	guttural pouch disorder, non-human animal			
MONDO:1013814	guttural pouch empyema, non-human animal			
MONDO:1013815	guttural pouch mycosis, non-human animal			
MONDO:1013816	pinna benign melanoma, non-human animal			
MONDO:1013817	pinna malignant melanoma, non-human animal			
MONDO:1013818	otitis externa due to water exposure, non-human animal			
MONDO:1013819	tympanic bulla disorder, non-human animal			
MONDO:1013820	tympanic bulla effusion, non-human animal			
MONDO:1013821	primary secretory otitis media of Cavalier King Charles Spaniel dogs			
MONDO:1013822	guttural pouch chondroids, non-human animal			
MONDO:1014044	adverse reaction to blood transfusion, non-human animal			
MONDO:1014045	bone implant fatigue failure, non-human animal			
MONDO:1014046	bone implant infection, non-human animal			
MONDO:1014047	bone implant loosening, non-human animal			
MONDO:1014048	bone implant migration, non-human animal			
MONDO:1014049	insulin overdose, non-human animal			
MONDO:1014050	post-operative gastrointestinal anastomotic dehiscence, non-human animal			
MONDO:1014051	post-operative hemorrhage, non-human animal			
MONDO:1014052	post-operative incisional hernia, non-human animal			
MONDO:1014053	post-operative infection, non-human animal			
MONDO:1014054	post-operative septicemia, non-human animal			
MONDO:1014055	post-operative wound breakdown, non-human animal			
MONDO:1014056	post-operative wound infection, non-human animal			
MONDO:1014057	post-operative MRSA wound infection, non-human animal			
MONDO:1014058	post-operative wound necrosis, non-human animal			
MONDO:1014059	complication of transvenous pacemaker placement, non-human animal			
MONDO:1014060	complication of fracture repair, non-human animal			
MONDO:1014061	injection site reaction, non-human animal			
MONDO:1014062	post-operative wound seroma, non-human animal			
MONDO:1014063	feline injection site fibrosarcoma			
MONDO:1014064	post-operative complication, non-human animal			
MONDO:1014065	post-operative self-trauma, non-human animal			
MONDO:1014066	post-operative pain, non-human animal			
MONDO:1014067	post-operative bruising, non-human animal			
MONDO:1014068	post-operative swelling, non-human animal			
MONDO:1014069	adverse reaction to plasma transfusion, non-human animal			
MONDO:1014070	bone implant complication, non-human animal			
MONDO:1014071	intracarotid injection complication, non-human animal			
MONDO:1014072	post-operative short bowel syndrome, non-human animal			
MONDO:1014073	post-castration complication, non-human animal			
MONDO:1014074	post-castration evisceration, non-human animal			
MONDO:1014075	post-castration hemorrhage, non-human animal			
MONDO:1014076	post-castration edema, non-human animal			
MONDO:1014077	scirrhous cord, non-human animal			
MONDO:1014078	post-castration septic funiculitis, non-human animal			
MONDO:1014079	post-castration septic peritonitis, non-human animal			
MONDO:1014080	post-castration wound infection, non-human animal			
MONDO:1014081	post-operative suture reaction, non-human animal			
MONDO:1014082	medical care complication, non-human animal			
MONDO:1014083	post-anesthetic malignant hyperthermia, non-human animal			
MONDO:1014084	post-anesthetic myelopathy, non-human animal			
MONDO:1014085	post-anesthetic gluteal myopathy, non-human animal			
MONDO:1014086	post-anesthetic triceps myopathy, non-human animal			
MONDO:1014087	post-anesthetic neuropathy, non-human animal			
MONDO:1014088	post-anesthetic facial neuropathy, non-human animal			
MONDO:1014089	post-anesthetic femoral neuropathy, non-human animal			
MONDO:1014090	post-anesthetic radial neuropathy, non-human animal			
MONDO:1014092	post-operative adhesions, non-human animal			
MONDO:1014093	post-operative colic, non-human animal			
MONDO:1014094	post-operative hydrocele, non-human animal			
MONDO:1014095	post-operative implant failure, non-human animal			
MONDO:1014096	post-operative implant infection, non-human animal			
MONDO:1014098	apocrine adenocarcinoma of anal sac, non-human animal			
MONDO:1014099	apocrine adenoma of anal sac, non-human animal			
MONDO:1014100	anal sac abscess, non-human animal			
MONDO:1014101	anal sac disorder, non-human animal			
MONDO:1014102	anal sac impaction, non-human animal			
MONDO:1014103	anal stricture, non-human animal			
MONDO:1014104	chronic colitis, non-human animal			
MONDO:1014105	lymphocytic/plasmacytic colitis, non-human animal			
MONDO:1014106	colonic stricture, non-human animal			
MONDO:1014107	cricopharyngeal achalasia, non-human animal			
MONDO:1014108	dental structure injury, non-human animal			
MONDO:1014109	diabetes mellitus resolved, non-human animal			
MONDO:1014110	dysphagia, non-human animal			
MONDO:1014111	esophageal dysphagia, non-human animal			
MONDO:1014112	pharyngeal dysphagia, non-human animal			
MONDO:1014113	lymphocytic/plasmacytic enteritis, non-human animal			
MONDO:1014114	fecal incontinence, non-human animal			
MONDO:1014115	gastric dilation, non-human animal			
MONDO:1014116	gastric dilatation-volvulus syndrome, non-human animal			
MONDO:1014117	gastric perforation, non-human animal			
MONDO:1014118	gastric rupture, non-human animal			
MONDO:1014119	chronic gastric torsion, non-human animal			
MONDO:1014120	gastric ulceration, non-human animal			
MONDO:1014121	acute gastritis, non-human animal			
MONDO:1014122	acute gastroenteritis, non-human animal			
MONDO:1014123	gastrointestinal hemorrhage, non-human animal			
MONDO:1014124	gingivitis/gingival disease, non-human animal			
MONDO:1014125	Helicobacter infection, non-human animal			
MONDO:1014126	Helicobacter-like organism infection, non-human animal			
MONDO:1014127	large intestine obstruction, non-human animal			
MONDO:1014128	small intestine obstruction, non-human animal			
MONDO:1014129	large intestine perforation, non-human animal			
MONDO:1014130	small intestine perforation, non-human animal			
MONDO:1014131	small intestine ulceration, non-human animal			
MONDO:1014132	gastroesophageal intussusception, non-human animal			
MONDO:1014133	ileocecal intussusception, non-human animal			
MONDO:1014134	ileocolic intussusception, non-human animal			
MONDO:1014135	large intestine intussusception, non-human animal			
MONDO:1014136	small intestine intussusception, non-human animal			
MONDO:1014137	intestinal lymphoma, non-human animal			
MONDO:1014138	intestinal malabsorption, non-human animal			
MONDO:1014139	anal mass lesion, non-human animal			
MONDO:1014140	anal gland/sac mass lesion, non-human animal			
MONDO:1014141	facial or lip mass lesion, non-human animal			
MONDO:1014142	gastric mass lesion, non-human animal			
MONDO:1014143	intestinal mass lesion, non-human animal			
MONDO:1014144	esophageal mass lesion, non-human animal			
MONDO:1014145	oral cavity mass lesion, non-human animal			
MONDO:1014146	pancreatic mass lesion, non-human animal			
MONDO:1014147	pharyngeal mass lesion, non-human animal			
MONDO:1014148	pyloric mass lesion, non-human animal			
MONDO:1014149	rectal mass lesion, non-human animal			
MONDO:1014150	tongue mass lesion, non-human animal			
MONDO:1014151	tonsillar mass lesion, non-human animal			
MONDO:1014152	acquired megacolon, non-human animal			
MONDO:1014153	idiopathic megacolon, non-human animal			
MONDO:1014154	canine idiopathic megaesophagus			
MONDO:1014155	anal gland/sac neoplasm, non-human animal			
MONDO:1014156	facial or lip neoplasm, non-human animal			
MONDO:1014157	large intestine neoplasm, non-human animal			
MONDO:1014158	small intestine neoplasm, non-human animal			
MONDO:1014159	pyloric neoplasm, non-human animal			
MONDO:1014160	salivary neoplasm, non-human animal			
MONDO:1014161	obstipation, non-human animal			
MONDO:1014162	esophageal diverticulum, non-human animal			
MONDO:1014163	esophageal injury, non-human animal			
MONDO:1014164	esophageal perforation, non-human animal			
MONDO:1014165	esophageal rupture, non-human animal			
MONDO:1014166	esophageal stenosis/stricture, non-human animal			
MONDO:1014167	esophageal ulceration, non-human animal			
MONDO:1014168	esophagitis, non-human animal	Esophagitis that occurs in non-human animals.		
MONDO:1014169	drug-related esophagitis, non-human animal			
MONDO:1014170	oronasal fistula, non-human animal			
MONDO:1014171	pancreatic cyst, non-human animal			
MONDO:1014172	pancreatic pseudocyst, non-human animal			
MONDO:1014173	acute, necrotizing pancreatitis, non-human animal			
MONDO:1014174	recurrent/relapsing pancreatitis, non-human animal			
MONDO:1014175	pharyngeal injury, non-human animal			
MONDO:1014176	pharyngeal obstruction, non-human animal			
MONDO:1014177	infectious pharyngitis, non-human animal			
MONDO:1014178	nasopharyngeal polyp, non-human animal			
MONDO:1014179	rectal stricture, non-human animal			
MONDO:1014180	gastrointestinal salmonellosis, non-human animal			
MONDO:1014181	sialoadenitis, non-human animal	Sialadenitis that occurs in non-human animals.		
MONDO:1014182	submandibular sialoadenitis, non-human animal			
MONDO:1014183	oral gingival squamous cell carcinoma, non-human animal			
MONDO:1014184	oral tongue squamous cell carcinoma, non-human animal			
MONDO:1014185	stomatitis, non-human animal	Stomatitis that occurs in non-human animals.		
MONDO:1014186	glossitis, non-human animal			
MONDO:1014187	tongue injury, non-human animal			
MONDO:1014188	tongue paralysis, non-human animal			
MONDO:1014189	tonsillar enlargement, non-human animal			
MONDO:1014190	trichobezoar, non-human animal			
MONDO:1014191	retained deciduous tooth, non-human animal			
MONDO:1014192	anal sac infection, non-human animal			
MONDO:1014193	anal sacculitis, non-human animal			
MONDO:1014194	salivary mass lesion, non-human animal			
MONDO:1014195	gingival mass lesion, non-human animal			
MONDO:1014196	mesenteric torsion/volvulus, non-human animal			
MONDO:1014197	presumed self-limiting diarrhea, non-human animal			
MONDO:1014198	presumed self-limiting vomiting, non-human animal			
MONDO:1014199	large intestine ulceration, non-human animal			
MONDO:1014200	parasitic gastrointestinal disorder, non-human animal			
MONDO:1014201	gastrointestinal helminth infestation, non-human animal			
MONDO:1014202	reflux esophagitis, non-human animal			
MONDO:1014203	nasopharyngeal stenosis, non-human animal			
MONDO:1014204	salivary mucocele, non-human animal			
MONDO:1014205	overgrown incisor, non-human animal			
MONDO:1014206	overgrown molar, non-human animal			
MONDO:1014207	phenobarbital responsive hypersialosis, non-human animal			
MONDO:1014208	antibiotic-responsive diarrhea, non-human animal			
MONDO:1014209	primary ileus, non-human animal			
MONDO:1014210	secondary ileus, non-human animal			
MONDO:1014211	secondary ileus - postoperative, non-human animal			
MONDO:1014212	sclerosing enteropathy, non-human animal			
MONDO:1014213	oral squamous cell carcinoma, non-human animal			
MONDO:1014214	large intestinal adenocarcinoma, non-human animal			
MONDO:1014215	salivary gland adenocarcinoma, non-human animal			
MONDO:1014216	mandible odontoma, non-human animal			
MONDO:1014217	maxilla odontoma, non-human animal			
MONDO:1014218	extraskeletal gastrointestinal osteosarcoma, non-human animal			
MONDO:1014219	large intestine carcinoid, non-human animal			
MONDO:1014220	small intestine carcinoid, non-human animal			
MONDO:1014221	stomach carcinoid, non-human animal			
MONDO:1014222	mandible cementoma, non-human animal			
MONDO:1014223	maxilla cementoma, non-human animal			
MONDO:1014224	salivary gland cystadenocarcinoma, non-human animal			
MONDO:1014225	salivary gland cystadenoma, non-human animal			
MONDO:1014226	intestinal fibrosarcoma, non-human animal			
MONDO:1014227	oral, mandible fibrosarcoma, non-human animal			
MONDO:1014228	oral, maxilla fibrosarcoma, non-human animal			
MONDO:1014229	oropharyngeal fibrosarcoma, non-human animal			
MONDO:1014230	gastrinoma, non-human animal	Gastrin-producing neuroendocrine tumor that occurs in non-human animals.		
MONDO:1014231	colonic gastrointestinal stromal tumor, non-human animal			
MONDO:1014232	rectal gastrointestinal stromal tumor, non-human animal			
MONDO:1014233	small intestinal gastrointestinal stromal tumor, non-human animal			
MONDO:1014234	gastric gastrointestinal stromal tumor, non-human animal			
MONDO:1014235	oropharyngeal granular cell myoblastoma, non-human animal			
MONDO:1014236	oropharyngeal hemangioma, non-human animal			
MONDO:1014237	benign oral melanocytic neoplasm, non-human animal			
MONDO:1014238	malignant oral melanocytic neoplasm, non-human animal			
MONDO:1014239	gastrointestinal plasmacytoma, non-human animal			
MONDO:1014240	oral plasmacytoma, non-human animal			
MONDO:1014241	regurgitation during/post anesthesia, non-human animal			
MONDO:1014242	vomiting during/post anesthesia, non-human animal			
MONDO:1014243	post-operative vomiting, non-human animal			
MONDO:1014244	chronic enteropathy, non-human animal			
MONDO:1014245	food-responsive enteropathy, non-human animal			
MONDO:1014247	dental tartar/calculus, non-human animal			
MONDO:1014248	flatulence, non-human animal			
MONDO:1014249	duodenogastric/pylorogastric intussusception, non-human animal			
MONDO:1014250	rotavirus diarrhea, non-human animal			
MONDO:1014251	salivary gland traumatic injury, non-human animal			
MONDO:1014252	enteropathy, non-human animal			
MONDO:1014253	intestinal intussusception, non-human animal			
MONDO:1014254	intestinal ulceration, non-human animal			
MONDO:1014255	ameloblastic odontoma, non-human animal			
MONDO:1014256	antibiotic-related diarrhea, non-human animal			
MONDO:1014257	atresia coli, non-human animal			
MONDO:1014258	atresia recti, non-human animal			
MONDO:1014259	cecal dilation, non-human animal			
MONDO:1014260	cecal impaction, non-human animal			
MONDO:1014261	cecal infarction, non-human animal			
MONDO:1014262	cecal volvulus/torsion, non-human animal			
MONDO:1014263	dental caps, non-human animal			
MONDO:1014264	Clostridial diarrhea, non-human animal			
MONDO:1014265	intestinal Clostridiosis, non-human animal			
MONDO:1014266	distention colic, non-human animal			
MONDO:1014267	flatulent colic, non-human animal			
MONDO:1014268	thromboembolic colic, non-human animal			
MONDO:1014269	coronavirus diarrhea, non-human animal			
MONDO:1014270	absent tooth/teeth dental disorder, non-human animal			
MONDO:1014271	acquired overgrowth of cheek teeth dental disorder, non-human animal			
MONDO:1014272	diastemata dental disorder, non-human animal			
MONDO:1014273	diastemata of cheek teeth dental disorder, non-human animal			
MONDO:1014274	displacement of cheek teeth dental disorder, non-human animal			
MONDO:1014275	ectopic tooth/teeth dental disorder, non-human animal			
MONDO:1014276	fracture dental disorder, non-human animal			
MONDO:1014277	infundibular caries dental disorder, non-human animal			
MONDO:1014278	infundibular caries, incisor dental disorder, non-human animal			
MONDO:1014279	infundibular caries, maxillary cheek teeth dental disorder, non-human animal			
MONDO:1014280	malocclusion dental disorder, non-human animal			
MONDO:1014281	malocclusion of incisors dental disorder, non-human animal			
MONDO:1014282	missing tooth/teeth dental disorder, non-human animal			
MONDO:1014283	occlusal surface abnormality dental disorder, non-human animal			
MONDO:1014284	retained tooth/teeth dental disorder, non-human animal			
MONDO:1014285	retained cheek tooth/teeth dental disorder, non-human animal			
MONDO:1014286	retained incisor dental disorder, non-human animal			
MONDO:1014287	rostral positioning of maxillary cheek teeth dental disorder, non-human animal			
MONDO:1014288	sharp edges dental disorder, non-human animal			
MONDO:1014289	supernumerary tooth/teeth dental disorder, non-human animal			
MONDO:1014290	supernumerary cheek tooth/teeth dental disorder, non-human animal			
MONDO:1014291	supernumerary incisor dental disorder, non-human animal			
MONDO:1014292	wolf tooth/teeth dental disorder, non-human animal			
MONDO:1014293	cheek tooth/teeth dental fracture, non-human animal			
MONDO:1014294	idiopathic dental fracture, non-human animal			
MONDO:1014295	incisor dental fracture, non-human animal			
MONDO:1014296	traumatic dental fracture, non-human animal			
MONDO:1014297	duodenal ulceration, non-human animal			
MONDO:1014298	duodenitis-proximal jejunitis, non-human animal			
MONDO:1014299	enteritis - antibiotic-associated, non-human animal			
MONDO:1014300	duodenitis, non-human animal			
MONDO:1014301	fungal enteritis, non-human animal			
MONDO:1014302	lymphocytic/plasmacytic enterocolitis, non-human animal			
MONDO:1014303	enteroliths, non-human animal			
MONDO:1014304	bacterial enteropathy, non-human animal			
MONDO:1014305	fungal enteropathy, non-human animal			
MONDO:1014306	viral enteropathy, non-human animal			
MONDO:1014307	equine monocytic ehrlichiosis			
MONDO:1014308	foal heat diarrhea, non-human animal			
MONDO:1014309	gastric impaction, non-human animal			
MONDO:1014310	gastroduodenal ulceration, non-human animal			
MONDO:1014311	hemorrhagic gastroenteritis, non-human animal			
MONDO:1014312	ileal impaction, non-human animal			
MONDO:1014313	intestinal displacement, non-human animal			
MONDO:1014314	left dorsal intestinal displacement/nephrosplenic entrapment, non-human animal			
MONDO:1014315	right dorsal intestinal displacement, non-human animal			
MONDO:1014316	large intestine impaction, non-human animal			
MONDO:1014317	small intestine impaction, non-human animal			
MONDO:1014318	intestinal incarceration, non-human animal			
MONDO:1014319	small intestine incarceration, non-human animal			
MONDO:1014320	intestinal infarction, non-human animal			
MONDO:1014321	large intestine infarction, non-human animal			
MONDO:1014322	non-strangulating intestinal infarction, non-human animal			
MONDO:1014323	small intestine infarction, non-human animal			
MONDO:1014324	intestinal rupture, non-human animal			
MONDO:1014325	large intestine rupture, non-human animal			
MONDO:1014326	small intestine rupture, non-human animal			
MONDO:1014327	intestinal torsion/volvulus, non-human animal			
MONDO:1014328	large intestine torsion/volvulus, non-human animal			
MONDO:1014329	small intestine torsion/volvulus, non-human animal			
MONDO:1014330	large colon enterolithiasis, non-human animal			
MONDO:1014331	large colon entrapment in epiploic foramen, non-human animal			
MONDO:1014332	large colon gastrosplenic ligament incarceration, non-human animal			
MONDO:1014333	congenital large colon malformation, non-human animal			
MONDO:1014334	large colon sand impaction, non-human animal			
MONDO:1014335	large colon torsion, non-human animal			
MONDO:1014336	large colon tympany, non-human animal			
MONDO:1014337	lip trauma, non-human animal			
MONDO:1014338	nasopharyngeal mass lesion, non-human animal			
MONDO:1014339	meconium impaction/retention, non-human animal			
MONDO:1014340	benign anal melanocytic neoplasm, non-human animal			
MONDO:1014341	benign lip melanocytic neoplasm, non-human animal			
MONDO:1014342	malignant anal melanocytic neoplasm, non-human animal			
MONDO:1014343	malignant lip melanocytic neoplasm, non-human animal			
MONDO:1014344	mesenteric rent entrapment, non-human animal			
MONDO:1014345	muscular hypertrophy of ileum, non-human animal			
MONDO:1014346	nasogastric reflux, non-human animal			
MONDO:1014347	nasopharyngeal collapse, non-human animal			
MONDO:1014348	dynamic dorsal nasopharyngeal collapse, non-human animal			
MONDO:1014349	dynamic lateral nasopharyngeal collapse, non-human animal			
MONDO:1014350	fixed nasopharyngeal collapse, non-human animal			
MONDO:1014351	ventral nasopharyngeal collapse, non-human animal			
MONDO:1014352	nasopharyngeal dysfunction of foals, non-human animal			
MONDO:1014353	necrotizing enterocolitis, non-human animal			
MONDO:1014354	nutritional diarrhea, non-human animal			
MONDO:1014355	esophageal fistula, non-human animal			
MONDO:1014356	esophageal impaction, non-human animal			
MONDO:1014357	esophageal intramural cyst, non-human animal			
MONDO:1014358	esophageal obstruction, non-human animal			
MONDO:1014359	palatitis, non-human animal			
MONDO:1014360	pharyngeal cyst, non-human animal			
MONDO:1014361	pharyngeal lymphoid hyperplasia, non-human animal			
MONDO:1014362	pharyngeal paralysis, non-human animal			
MONDO:1014363	traumatic pharyngitis, non-human animal			
MONDO:1014364	rectal tear, non-human animal			
MONDO:1014365	rectal tear - grade I, non-human animal			
MONDO:1014366	rectal tear - grade II, non-human animal			
MONDO:1014367	rectal tear - grade IIIa, non-human animal			
MONDO:1014368	rectal tear - grade IIIb, non-human animal			
MONDO:1014369	rectal tear - grade IV, non-human animal			
MONDO:1014370	rectovaginal fistula, non-human animal			
MONDO:1014371	congenital rectovaginal fistula, non-human animal			
MONDO:1014372	traumatic rectovaginal fistula, non-human animal			
MONDO:1014373	right dorsal colitis, non-human animal			
MONDO:1014374	parotid salivary duct atresia, non-human animal			
MONDO:1014375	idiopathic parotiditis, non-human animal			
MONDO:1014377	sinusitis, secondary to dental disease, non-human animal			
MONDO:1014378	small colon enterolithiasis, non-human animal			
MONDO:1014379	small colon fecal impaction, non-human animal			
MONDO:1014380	small colon fecalith, non-human animal			
MONDO:1014381	small colon meconium impaction, non-human animal			
MONDO:1014382	small colon obstruction with mesocolic rupture, non-human animal			
MONDO:1014383	small colon phytobezoar, non-human animal			
MONDO:1014384	small colon phytoconglobate, non-human animal			
MONDO:1014385	small colon phytotrichobezoar, non-human animal			
MONDO:1014386	small colon trichobezoar, non-human animal			
MONDO:1014387	small intestinal entrapment in epiploic foramen, non-human animal			
MONDO:1014388	small intestinal fibrosis, non-human animal			
MONDO:1014389	small intestinal gastrosplenic ligament incarceration, non-human animal			
MONDO:1014390	small intestinal obstruction with mesenteric rent, non-human animal			
MONDO:1014391	small intestinal obstruction with vitelline anomaly, non-human animal			
MONDO:1014393	feline gingivitis-stomatitis complex			
MONDO:1014394	feline odontoclastic resorptive lesion			
MONDO:1014395	gingival hyperplasia, non-human animal			
MONDO:1014396	dental wear, non-human animal			
MONDO:1014397	teething dental disorder, non-human animal			
MONDO:1014398	eosinophilic enteritis, non-human animal			
MONDO:1014399	seasonal canine illness			
MONDO:1014401	cecal dysfunction, non-human animal			
MONDO:1014402	cecal tympany, non-human animal			
MONDO:1014403	clostridial enterocolitis, non-human animal			
MONDO:1014404	spasmodic/undifferentiated colic, non-human animal			
MONDO:1014405	impaction colic, non-human animal			
MONDO:1014406	recurrent colic, non-human animal			
MONDO:1014407	colitis X, non-human animal			
MONDO:1014408	colonic tympany, non-human animal			
MONDO:1014410	salmonellosis-associated diarrhea, non-human animal			
MONDO:1014411	anterior enteritis, non-human animal			
MONDO:1014412	proliferative enteropathy, non-human animal			
MONDO:1014413	epiploic foramen entrapment, non-human animal			
MONDO:1014414	large colon impaction, non-human animal			
MONDO:1014415	large colon, pelvic flexure impaction, non-human animal			
MONDO:1014416	small colon impaction, non-human animal			
MONDO:1014417	small intestine strangulation, non-human animal			
MONDO:1014418	intestinal strangulation, non-human animal			
MONDO:1014419	small colon torsion/volvulus, non-human animal			
MONDO:1014420	wave mouth, non-human animal			
MONDO:1014421	abomasal bloat, non-human animal			
MONDO:1014422	abomasal dilation, non-human animal			
MONDO:1014423	abomasal impaction, non-human animal			
MONDO:1014424	abomasal torsion, non-human animal			
MONDO:1014425	abomasal ulceration, non-human animal			
MONDO:1014426	bovine papular stomatitis, non-human animal			
MONDO:1014427	bovine viral diarrhea, non-human animal			
MONDO:1014428	Clostridium chauvoei clostridial disease, non-human animal			
MONDO:1014429	Clostridium haemolyticum clostridial disease, non-human animal			
MONDO:1014430	Clostridium novyi clostridial disease, non-human animal			
MONDO:1014431	Clostridium perfringens type D clostridial disease, non-human animal			
MONDO:1014432	Clostridium perfringens enterotoxaemia, non-human animal			
MONDO:1014433	Clostridium septicum clostridial disease, non-human animal			
MONDO:1014434	Clostridium sordellii abomasitis, non-human animal			
MONDO:1014435	idiopathic necrotizing enteritis, non-human animal			
MONDO:1014436	necrotic enteritis, non-human animal			
MONDO:1014437	free gas ruminal bloat, non-human animal			
MONDO:1014438	frothy gas ruminal bloat, non-human animal			
