mondo_id	property	value_old	value_new
MONDO:0000417	label	early onset absence epilepsy	obsolete early onset absence epilepsy
MONDO:0002003	label	papilledema	obsolete papilledema
MONDO:0005562	label	age-related hearing impairment	obsolete age-related hearing impairment
MONDO:0007736	label	HPA 1 Recognition polymorphism, beta-globin-related	obsolete HPA 1 Recognition polymorphism, beta-globin-related
MONDO:0018790	label	obsolete COL4A1 or COL4A2-related cerebral small vessel disease with hemorrhagic tendancy	obsolete COL4A1 or COL4A2-related cerebral small vessel disease with hemorrhagic tendency
MONDO:0008302	label	centra precocious puberty 1	central precocious puberty 1
MONDO:0012360	label	congenital nongoitrous hypothryoidism 3	congenital nongoitrous hypothyroidism 3
MONDO:0013400	label	Congenital adrenal insuffiency with 46, XY sex reversal OR 46,XY disorder of sex development-adrenal insufficiency due to CYP11A1 deficiency	Congenital adrenal insufficiency with 46, XY sex reversal OR 46,XY disorder of sex development-adrenal insufficiency due to CYP11A1 deficiency
MONDO:0013757	label	congenital nongoitrous hypothryoidism 6	congenital nongoitrous hypothyroidism 6
MONDO:0014493	label	autoimmune lymphoproliferative syndrome due to CTLA4 haploinsuffiency	autoimmune lymphoproliferative syndrome due to CTLA4 haploinsufficiency
MONDO:0018789	label	obsolete COL4A1 or COL4A2-related cerebral small vessel disease with ischemic tendancy	obsolete COL4A1 or COL4A2-related cerebral small vessel disease with ischemic tendency
MONDO:0022884	label	craniofacial dysostosis arthrogryposis progeroid appearence	craniofacial dysostosis arthrogryposis progeroid appearance
MONDO:0800306	label	epilepsy, progressive myoclonic, 2b	myoclonic epilepsy of Lafora 2
MONDO:0800384	label	cessium poisoning	cesium poisoning
MONDO:0958201	label	myoclonic epilepsy of Lafora 2	obsolete myoclonic epilepsy of Lafora 2
MONDO:0000291	definition	Granulomatous amebic encephalitis is a life-threatening infection of the brain caused by the free-living amoebae Acanthamoeba spp., Balamuthia mandrillaris and Sappinia pedata. Acanthamoeba species, are commonly found in lakes, swimming pools, tap water, and heating and air conditioning units. The disease affects immunocompromised peple and is very serious. Symptoms include mental status changes, loss of coordination, fever, muscular weakness or partial paralysis affecting one side of the body, double vision, sensitivity to light and other neurologic problems. The diagnosis is difficult and is often made at advanced stages. Tests useful in the diagnosis include brain scans, biopsies, or spinal taps and in disseminated disease, biopsy of the involved sites and testing by the laboratory experts. Early diagnosis is important for the prognosis. No single drug is effective; hence multiple antibiotics are needed for successful treatment. A combination of surgical and medical interventions involving multiple specialty experts is required to prevent death and morbidity in survivors.	Granulomatous amebic encephalitis is a life-threatening infection of the brain caused by the free-living amoebae Acanthamoeba spp., Balamuthia mandrillaris and Sappinia pedata. Acanthamoeba species, are commonly found in lakes, swimming pools, tap water, and heating and air conditioning units. The disease affects immunocompromised people and is very serious. Symptoms include mental status changes, loss of coordination, fever, muscular weakness or partial paralysis affecting one side of the body, double vision, sensitivity to light and other neurologic problems. The diagnosis is difficult and is often made at advanced stages. Tests useful in the diagnosis include brain scans, biopsies, or spinal taps and in disseminated disease, biopsy of the involved sites and testing by the laboratory experts. Early diagnosis is important for the prognosis. No single drug is effective; hence multiple antibiotics are needed for successful treatment. A combination of surgical and medical interventions involving multiple specialty experts is required to prevent death and morbidity in survivors.
MONDO:0000417	definition	A childhood electroclinical syndrome characterized by the occurrence of typical absence seizures starting between the age of four and ten years.	
MONDO:0000598	definition	A language disorder that involves an acquired impairment of any laguage modality such as producting or comprehending spoken or written language.	A language disorder that involves an acquired impairment of any language modality such as producing or comprehending spoken or written language.
MONDO:0000666	definition	An agnosia that is a loss of the ability to recognize visual scenes or classes of objects but retain the abilty to describe them.	An agnosia that is a loss of the ability to recognize visual scenes or classes of objects but retain the ability to describe them.
MONDO:0000671	definition	An agnosia characterized by an inabilty to distinguish, name, or recognize the fingers	An agnosia characterized by an inability to distinguish, name, or recognize the fingers
MONDO:0000678	definition	An agnosia that is a loss of the ability to recgonize a whole image or scene while retianing the ability to recognize objects or details in their visual field one at a time.	An agnosia that is a loss of the ability to recognize a whole image or scene while retaining the ability to recognize objects or details in their visual field one at a time.
MONDO:0001220	definition	Hypoparathyroidism is is an endocrine disorder in which the parathyroid glands in the neck do not produce enough parathyroid hormone (PTH). Common signs and symptoms includeabdominal pain, brittle nails, cataracts, dry hair and skin,muscle cramps,tetany, pain in the face, legs, and feet, seizures, tingling sensation,and weakened tooth enamel (in children). It may be caused byinjury to the parathyroid glands (e.g., during surgery). Other causes, include low blood magnesium levels, a side effect of radioactive iodine treatment for hyperthyroidism, metabolic alkalosis, DiGeorge syndrome, and type I polyglandular autoimmune syndrome. The goal of treatment is to restore the calcium and mineral balance in the body.	Hypoparathyroidism is an endocrine disorder in which the parathyroid glands in the neck do not produce enough parathyroid hormone (PTH). Common signs and symptoms include abdominal pain, brittle nails, cataracts, dry hair and skin, muscle cramps, tetany, pain in the face, legs, and feet, seizures, tingling sensation, and weakened tooth enamel (in children). It may be caused by injury to the parathyroid glands (e.g., during surgery). Other causes, include low blood magnesium levels, a side effect of radioactive iodine treatment for hyperthyroidism, metabolic alkalosis, DiGeorge syndrome, and type I polyglandular autoimmune syndrome. The goal of treatment is to restore the calcium and mineral balance in the body.
MONDO:0001954	definition	A thrombophlebitis that is characterized by repeated occurances of thrombophlebitis in different locations.	A thrombophlebitis that is characterized by repeated occurrences of thrombophlebitis in different locations.
MONDO:0001998	definition	Conditions which produce injury or dysfunction of the second cranial or optic nerve, which is generally considered a component of the central nervous system. Damage to optic nerve fibers may occur at or near their origin in the retina, at the optic disk, or in the nerve, optic chiasm, optic tract, or lateral geniculate nuclei. Clinical manifestations may include decreased visual acuity and contrast sensitivity, impaired color vision, and an afferent pupillary defect.	An eye disorder characterized by an insidious reduction in vision in one eye, accompanied by clinically significant papilledema in the fellow eye. The unilateral loss of vision and optic atrophy is due to compressive optic atrophy, which causes elevated intracranial pressure that leads to swelling in the fellow eye.
MONDO:0002003	definition	Swelling around the optic disk, usually due to increased intracranial pressure or pressure on the optic nerve by a tumor.	
MONDO:0002304	definition	Protein S deficiency is a disorder that causes abnormal blood clotting. When someone bleeds, the blood begins a complicated series of rapid chemical reactions involving proteins called blood coagulation factors to stop the bleeding. Other proteins in the blood, such as protein S, usually regulate these chemical reactions to prevent excessive clotting. When protein S is missing (deficient), clotting may not be regulatednormally and affected individuals havean increased risk of forming a blood clot called a thrombosis. People at risk to haveprotein S deficiencyare those with an individual or family history of multiple blood clots in the veins. Treatment may include taking medication known as blood thinners to decrease the chance of developing a blood clot.	Protein S deficiency is a disorder that causes abnormal blood clotting. When someone bleeds, the blood begins a complicated series of rapid chemical reactions involving proteins called blood coagulation factors to stop the bleeding. Other proteins in the blood, such as protein S, usually regulate these chemical reactions to prevent excessive clotting. When protein S is missing (deficient), clotting may not be regulatednormally and affected individuals have an increased risk of forming a blood clot called a thrombosis. People at risk to haveprotein S deficiency are those with an individual or family history of multiple blood clots in the veins. Treatment may include taking medication known as blood thinners to decrease the chance of developing a blood clot.
MONDO:0016691	definition	Pilocytic astrocytoma is a rare subtype of low-grade glioma of the central nervous system characterized by a well circumscribed, often cystic, brain tumor with a discrete mural nodule and long, hair-like projections that extend from the neoplastic astrocytes. Depending on the primary localization and the size of the tumor, patients can present with signs of raised intracranial pressure (headache, vomiting, papilledema), blurred vision, decreased visual acuity, ataxia and/or nystagmus, among others. It is most commonly located in the cerebellum, but ocurrence in the hypothalamus, brain stem, optic chiasma, and hemispheres has also been reported.	Pilocytic astrocytoma is a rare subtype of low-grade glioma of the central nervous system characterized by a well circumscribed, often cystic, brain tumor with a discrete mural nodule and long, hair-like projections that extend from the neoplastic astrocytes. Depending on the primary localization and the size of the tumor, patients can present with signs of raised intracranial pressure (headache, vomiting, papilledema), blurred vision, decreased visual acuity, ataxia and/or nystagmus, among others. It is most commonly located in the cerebellum, but occurrence in the hypothalamus, brain stem, optic chiasma, and hemispheres has also been reported.
MONDO:0005470	definition	Drastic decline in blood pressure which happens after eating a meal and most likely due to insufficient compensation in cardiac output by the autonomic nervous sytem for the diversion of blood to the intestines.	Drastic decline in blood pressure which happens after eating a meal and most likely due to insufficient compensation in cardiac output by the autonomic nervous system for the diversion of blood to the intestines.
MONDO:0005562	definition	Age-related hearing impairment is characterized by a symmetric sensorineural hearing loss that is most pronounced in the high frequencies. Age of onset, progression, and severity of age-related hearing impairment (ARHI) show great variation in the population, but with a demonstrable increased prevalence in males.	
MONDO:0005581	definition	Malignant lymphoma of the bursa of Fabricius, induced by avian leukosis virus occuring in birds.	Malignant lymphoma of the bursa of Fabricius, induced by avian leukosis virus occurring in birds.
MONDO:0005817	definition	Kluver Bucy syndrome is a rare behavioral impairment characterized byinappropriate sexual behaviors and mouthing of objects. Other signs and symptoms, includea diminished ability to visually recognize objects,loss of normal fear and anger responses, memory loss, distractibility, seizures, and dementia. It is associated with damage to the anterior temporal lobes of the brain. Cases have been reported in association with herpes encephalitis and head trauma. Treatment is symptomatic and may include the use of psychotropic medications.	Kluver Bucy syndrome is a rare behavioral impairment characterized by inappropriate sexual behaviors and mouthing of objects. Other signs and symptoms include diminished ability to visually recognize objects,loss of normal fear and anger responses, memory loss, distractibility, seizures, and dementia. It is associated with damage to the anterior temporal lobes of the brain. Cases have been reported in association with herpes encephalitis and head trauma. Treatment is symptomatic and may include the use of psychotropic medications.
MONDO:0006595	definition	Jaundice in perinates due to cellular damange of liver.	Jaundice in perinates due to cellular damage of liver.
MONDO:0007295	definition	A childhood-onset epilepsy syndrom that is characterized by onset of seizures between 3 and 14 years (peak 8-9 years) that usually resolve by age 13 years, but can occasionally occur up to age 18 years of age. Both sexes are affected. Antecedent, birth and neonatal history is normal. A history of febrile seizure (in 5-15%) may be seen. A history of Panayiotopoulos syndrome may be present in a very small number of cases. Neurological exam and head size is normal. Development and cognition prior to onset of seizures is normal. During the course of the active epilepsy, behavioral and neuropsychological deficits may be found, particularly in language and executive functioning. These deficits improve when seizures remit.	A childhood-onset epilepsy syndrome that is characterized by onset of seizures between 3 and 14 years (peak 8-9 years) that usually resolve by age 13 years, but can occasionally occur up to age 18 years of age. Both sexes are affected. Antecedent, birth and neonatal history is normal. A history of febrile seizure (in 5-15%) may be seen. A history of Panayiotopoulos syndrome may be present in a very small number of cases. Neurological exam and head size is normal. Development and cognition prior to onset of seizures is normal. During the course of the active epilepsy, behavioral and neuropsychological deficits may be found, particularly in language and executive functioning. These deficits improve when seizures remit.
MONDO:0018878	definition	Branchiootic syndrome is a rare, genetic multiple congenital anomalies syndrome characterized by second branchial arch anomalies (branchial cysts and fistulae), malformations of the outer, middle and inner ear associated with sensorineural, mixed or conductive hearing loss, and the absence of renal abnormalities. Typical ear findings consist of malformed auricles (e.g. lop or cupped ears), preauricular pits and/or tags, and middle and/or inner ear dysplasias (inculding cochlear, vestibular and semicircular channel hypoplasia, malformation of the ossicles and of middle ear space).	Branchiootic syndrome is a rare, genetic multiple congenital anomalies syndrome characterized by second branchial arch anomalies (branchial cysts and fistulae), malformations of the outer, middle and inner ear associated with sensorineural, mixed or conductive hearing loss, and the absence of renal abnormalities. Typical ear findings consist of malformed auricles (e.g. lop or cupped ears), preauricular pits and/or tags, and middle and/or inner ear dysplasias (including cochlear, vestibular and semicircular channel hypoplasia, malformation of the ossicles and of middle ear space).
MONDO:0007448	definition	Familial dermographism is a condition also known as skin writing. When people who have dermatographia lightly scratch their skin, the scratches redden into a raised wheal similar to hives. Signs and symptoms of dermatographia include raised red lines, swelling, inflammation, hive-like welts and itching. Symptoms usually disappear within 30 minutes. The exact cause of this condition is unknown. Treatment may invovle use of antihistamines if symptoms do not go away on their own.	Familial dermographism is a condition also known as skin writing. When people who have dermatographia lightly scratch their skin, the scratches redden into a raised wheal similar to hives. Signs and symptoms of dermatographia include raised red lines, swelling, inflammation, hive-like welts and itching. Symptoms usually disappear within 30 minutes. The exact cause of this condition is unknown. Treatment may involve use of antihistamines if symptoms do not go away on their own.
MONDO:0008520	definition	Brachydactyly-elbow wrist dysplasia syndrome is a rare, genetic bone development disorder characterized by dysplasia of all the bony components of the elbow joint, abnormally shaped carpal bones, wrist joint radial deviation and brachydactyly. Patients typically present with slight flexion at the elbow joints (with impossibilty to perform active extension) and usually associate a limited range of motion of the elbow, wrist and finger articulations. Camptodactyly and syndactyly have also been reported.	Brachydactyly-elbow wrist dysplasia syndrome is a rare, genetic bone development disorder characterized by dysplasia of all the bony components of the elbow joint, abnormally shaped carpal bones, wrist joint radial deviation and brachydactyly. Patients typically present with slight flexion at the elbow joints (with impossibility to perform active extension) and usually associate a limited range of motion of the elbow, wrist and finger articulations. Camptodactyly and syndactyly have also been reported.
MONDO:0008594	definition	A rare, genetic, skin tumor disorder characterized by childhood-onset of multiple, benign, asymptomatic, white to flesh-colored papules predominently located on the face, ears, neck and trunk, not associated with systemic organ involvement, associated malignancies or FLCN gene locus mutation.	A rare, genetic, skin tumor disorder characterized by childhood-onset of multiple, benign, asymptomatic, white to flesh-colored papules predominantly located on the face, ears, neck and trunk, not associated with systemic organ involvement, associated malignancies or FLCN gene locus mutation.
MONDO:0018479	definition	Congenital adrenal hyperplasia (CAH) is an inherited endocrine disorder caused by a steroidogenic enzyme deficiency that is characterized by adrenal insufficiency and variable degrees of hyper or hypo androgeny manifestations, depending of the type and the severity of the disease.	Congenital adrenal hyperplasia (CAH) is an inherited endocrine disorder caused by a steroidogenic enzyme deficiency that is characterized by adrenal insufficiency and variable degrees of hyper or hypo androgyny manifestations, depending of the type and the severity of the disease.
MONDO:0017417	definition	A rare, genetic, developmental defect during embryogenesis syndrome characterized by the triad of pancreatic fibrosis (and cysts, with a reduction of parenchymal tissue), renal dysplasia (with peripheral cortical cysts, primitive collecting ducts, glomerular cysts and metaplastic cartilage) and hepatic dysgenesis (enlarged portal areas containing numerous elongated binary profiles with a tendancy to perilobular fibrosis). Situs abnormalities, skeletal anomalies and anencephaly have also been associated. Patients that survive the neonatal period present renal insufficiency, chronic jaundice and insulin-dependant diabetes.	A rare, genetic, developmental defect during embryogenesis syndrome characterized by the triad of pancreatic fibrosis (and cysts, with a reduction of parenchymal tissue), renal dysplasia (with peripheral cortical cysts, primitive collecting ducts, glomerular cysts and metaplastic cartilage) and hepatic dysgenesis (enlarged portal areas containing numerous elongated binary profiles with a tendency to perilobular fibrosis). Situs abnormalities, skeletal anomalies and anencephaly have also been associated. Patients that survive the neonatal period present renal insufficiency, chronic jaundice and insulin-dependant diabetes.
MONDO:0008867	definition	A rare, biliary tract disease characterized by progressive obliterative cholangiopathy of the intra- and extrahepatic bile ducts, occuring in the embryonic/ perinatal period, leading to severe and persistent neonatal jaundice and acholic stool.	A rare, biliary tract disease characterized by progressive obliterative cholangiopathy of the intra- and extrahepatic bile ducts, occurring in the embryonic/ perinatal period, leading to severe and persistent neonatal jaundice and acholic stool.
MONDO:0009109	definition	Lysinuric protein intolerance (LPI) is a very rare inherited multisystem condition caused by distrubance in amino acid metabolism.	Lysinuric protein intolerance (LPI) is a very rare inherited multisystem condition caused by disturbance in amino acid metabolism.
MONDO:0009124	definition	A rare multiple congenital syndrome characterized primarly by growth retardation, microcephaly, distinctive facial dysmorphism, cutaneous eczema, a mild to severe intellectual deficit and genital abnormalities.	A rare multiple congenital syndrome characterized primarily by growth retardation, microcephaly, distinctive facial dysmorphism, cutaneous eczema, a mild to severe intellectual deficit and genital abnormalities.
MONDO:0009622	definition	Jawad syndrome is a rare, genetic, multiple congenital anomalies/dysmorphic syndrome characterized by congenital microcephaly wih facial dysmorphism (sloping forehead, prominent nose, mild retrognathia), moderate to severe, non-progressive intellectual disability and symmetrical digital malformations of variable degree, including brachydactyly of the fifth fingers with single flexion crease, clinodactyly, syndactyly, polydactyly and hallux valgus. Congenital anonychia and white café au lait-like spots on the skin of hands and feet are also associated.	Jawad syndrome is a rare, genetic, multiple congenital anomalies/dysmorphic syndrome characterized by congenital microcephaly with facial dysmorphism (sloping forehead, prominent nose, mild retrognathia), moderate to severe, non-progressive intellectual disability and symmetrical digital malformations of variable degree, including brachydactyly of the fifth fingers with single flexion crease, clinodactyly, syndactyly, polydactyly and hallux valgus. Congenital anonychia and white café au lait-like spots on the skin of hands and feet are also associated.
MONDO:0017868	definition	A rare, genetic, non-syndromic cerebral malformation characterized by severe intellectual disability, progressive postnatal microcephaly, axial hypotonia, spastic quadriparesis, seizures and facial dysmorphism (bushy eyebrows, hairy forehead, broad nasal root, long flat philtrum, V-shaped upper lip). Additionaly, talipes equinovarus, non-obstructive cardiomyopathy, persistent hyperplastic primary vitreous, obstructive hydrocephalus and autistic features may also be associated. On brain magnetic resonance imaging, the 'butterfly sign' is characterisitcally observed and cortical calcifications, agenesis of the corpus callosum, ventriculomegaly, brainstem dysplasia and cerebellar vermis hypoplasia have also been described.	A rare, genetic, non-syndromic cerebral malformation characterized by severe intellectual disability, progressive postnatal microcephaly, axial hypotonia, spastic quadriparesis, seizures and facial dysmorphism (bushy eyebrows, hairy forehead, broad nasal root, long flat philtrum, V-shaped upper lip). Additionally, talipes equinovarus, non-obstructive cardiomyopathy, persistent hyperplastic primary vitreous, obstructive hydrocephalus and autistic features may also be associated. On brain magnetic resonance imaging, the 'butterfly sign' is characterisitcally observed and cortical calcifications, agenesis of the corpus callosum, ventriculomegaly, brainstem dysplasia and cerebellar vermis hypoplasia have also been described.
MONDO:0009908	definition	Pterin-4 alpha-carbinolamine dehydratase 1 (PCBD1) deficiency is considered a transient and benign form of hyperphenylalaninemia due to tetrahydrobiopterin deficiency, characterized by muscular hypotonia, irritability (detected by EEG), slow acquisition of psychomotor skills, age-dependent movement disorders, including dystonia and an accompanying excretion of 7-substituted pterins. Neurological developement is normal with dietary control of blood phenyalanine. PCBD1 is inherited in an autosomal recessive manner.	Pterin-4 alpha-carbinolamine dehydratase 1 (PCBD1) deficiency is considered a transient and benign form of hyperphenylalaninemia due to tetrahydrobiopterin deficiency, characterized by muscular hypotonia, irritability (detected by EEG), slow acquisition of psychomotor skills, age-dependent movement disorders, including dystonia and an accompanying excretion of 7-substituted pterins. Neurological development is normal with dietary control of blood phenyalanine. PCBD1 is inherited in an autosomal recessive manner.
MONDO:0017905	definition	A rare group of immunodeficiencies due to specific mutations in the inhibitor of kappa light polypeptide gene enhancer in B-cells, kinase gamma (IKBKG) or the cytochrome b-245, beta polypeptide (CYBB) genes. They are characterized by mycobacterial infections, occuring in males.	A rare group of immunodeficiencies due to specific mutations in the inhibitor of kappa light polypeptide gene enhancer in B-cells, kinase gamma (IKBKG) or the cytochrome b-245, beta polypeptide (CYBB) genes. They are characterized by mycobacterial infections, occurring in males.
